,ScheduledDeparture time,ActualDeparture time,DepartureGate varchar(55),ScheduledArrival time,ActualArrival time,ArrivalGate varchar(55)
74,,12/1/2011 12:55PM EST,,,12/1/2011 3:12PM PST,
90,,12/1/11 12:56 PM (-05:00),,,12/1/11 3:12 PM (-08:00),
105,,2011-12-01 12:35,D1,,2011-12-01 15:19,75B
109,,2011-12-01 12:35,D1,,2011-12-01 15:19,75B
129,,12:56 PMDec 01,,,3:11 PMDec 01,
168,,8:40 PMDec 01,,,9:11 PMDec 01,
200,7:10 AM_ Dec 01,7:32 AM_ Dec 01,,3:30 PM_ Dec 01,3:09 PM_ Dec 01,
217,7:00 AM_ Dec 01,7:25 AM_ Dec 01,,9:55 AM_ Dec 01,9:45 AM_ Dec 01,
247,6:00 AM_ Dec 01,6:57 AM_ Dec 01,,7:30 AM_ Dec 01,7:51 AM_ Dec 01,
271,6:40 AM_ Dec 01,6:54 AM_ Dec 01,Terminal D - D22,9:25 AM_ Dec 01,9:28 AM_ Dec 01,Terminal 8 - 6
374,2011-12-01 11:05,2011-12-01 11:30,,2011-12-01 16:57,2011-12-01 17:05,
380,11:05 AM_ Dec 01,11:45 AM_ Dec 01,,4:57 PM_ Dec 01,5:03 PM_ Dec 01,
403,11:55 AM_ Dec 01,11:55 AM_ Dec 01,Terminal 4,6:17 PM_ Dec 01,6:17 PM_ Dec 01,A12
450,,12:06 PMDec 01,,,1:14 PMDec 01,
459,,12/1/11 12:07 PM (-05:00),,,12/1/11 1:11 PM (-05:00),
473,12:00 PM_ Dec 01,12:08 PM_ Dec 01,,1:45 PM_ Dec 01,1:14 PM_ Dec 01,
489,,10:53 AMDec 01,,,11:21 AMDec 01,
512,,12:58 AMDec 01,,,5:26 AMDec 01,
517,2011-12-01 0:30,2011-12-01 0:41,,2011-12-01 5:35,2011-12-01 5:26,
528,01:00 PM  Thu 01-Dec-2011,02:04 PM  Thu 01-Dec-2011,C36,02:35 PM  Thu 01-Dec-2011,03:20 PM  Thu 01-Dec-2011 (Runway),4
535,1:00 PM_ Dec 01,2:04 PM_ Dec 01,C36,2:35 PM_ Dec 01,3:19 PM_ Dec 01,Terminal 3
545,12/01/2011 06:00 AM,12/01/2011 06:08 AM,A27,12/01/2011 09:20 AM,12/01/2011 09:05 AM,D1
549,,12/1/11 6:09 AM (-06:00),,,12/1/11 8:50 AM (-05:00),
568,,,,9:20A 12-01-11,2011-12-01  9:04A,
576,,12/1/11 4:44 PM (-05:00),,,12/1/11 6:28 PM (-05:00),
637,,7:31 AMDec 01,,,10:45 AMDec 01,
680,,2:59 PMDec 01,,,7:10 PMDec 01,
688,12/1/2011 5:30PM CST,,,12/1/2011 6:40PM CST,,
692,,12/1/11 5:38 PM (-06:00),,,12/1/11 6:19 PM (-06:00),
727,,12/1/11 1:09 PM (-07:00),,,12/1/11 4:52 PM (-06:00),
730,,12/1/11 1:09 PM (-07:00),,,12/1/11 4:52 PM (-06:00),
748,,2011-12-01 13:32,3,,2011-12-01 17:34,B14
787,2011-12-01 11/30 12:57 PM,,3,2011-12-01 11/30 5:15 PM,,B8
795,,12/1/11 11:06 AM (-06:00),,,12/1/11 2:39 PM (-05:00),
807,10:40 AM_ Dec 01,11:06 AM_ Dec 01,H15,2:45 PM_ Dec 01,2:46 PM_ Dec 01,Terminal D - D1
812,2011-12-01 10:40,2011-12-01 11:06,,2011-12-01 14:45,2011-12-01 14:36,
816,2011-12-01 10:40,2011-12-01 11:06,,2011-12-01 14:45,2011-12-01 14:36,
866,2011-12-01 07:10AM EST,2011-12-01 07:39AM EST,36,2011-12-01 10:09AM PST,2011-12-01 10:52AM PST,58B
877,2011-12-01 14:55,2011-12-01 15:31,,2011-12-01 16:49,2011-12-01 17:26,
886,2011-12-01 14:55,,,2011-12-01 16:49,,
953,2011-12-01 14:35,2011-12-01 14:44,,2011-12-01 16:05,2011-12-01 15:43,
956,2:35 PM_ Dec 01,2:44 PM_ Dec 01,A7,4:05 PM_ Dec 01,3:36 PM_ Dec 01,H3A
978,01:33 PM  Thu 01-Dec-2011,01:31 PM  Thu 01-Dec-2011,C30,04:31 PM  Thu 01-Dec-2011,04:23 PM  Thu 01-Dec-2011,D9
979,2011-12-01 13:33,2011-12-01 13:31,,2011-12-01 16:31,2011-12-01 16:23,
1009,,7:41 AMDec 01,,,8:45 AMDec 01,
1036,10:40 AM_ Dec 01,10:55 AM_ Dec 01,,12:55 PM_ Dec 01,12:48 PM_ Dec 01,
1043,Thu_ Dec 1 8:00 AM,Thu_ Dec 1 8:29 AM,12,Thu_ Dec 1 11:55 AM,Thu_ Dec 1 11:58 AM,83
1053,2011-12-01 8:00,2011-12-01 8:29,,2011-12-01 11:55,2011-12-01 11:58,
1071,2011-12-01 07:15AM MST,2011-12-01 07:23AM MST,6,2011-12-01 10:57AM CST,2011-12-01 11:04AM CST,H15
1075,07:15 AM  Thu 01-Dec-2011,07:22 AM  Thu 01-Dec-2011,6,11:35 AM  Thu 01-Dec-2011,11:06 AM  Thu 01-Dec-2011,H15
1118,,12/1/11 8:23 PM (-05:00),,,12/1/11 9:47 PM (-06:00),
1145,,12/1/11 11:52 AM (-05:00),,,12/1/11 2:21 PM (-08:00),
1155,11:35 AM_ Dec 01,11:52 AM_ Dec 01,D51,2:25 PM_ Dec 01,2:27 PM_ Dec 01,Terminal T4 - 46A
1177,,6:10 AMDec 01,,,7:17 AMDec 01,
1192,12/1/11 7:10 PM (-06:00),,,12/1/11 8:56 PM (-08:00),,
1200,2011-12-01 19:10,2011-12-01 20:25,,2011-12-01 20:56,2011-12-01 9:52 PM (Estimated),
1229,2011-12-01 8:29,,,2011-12-01 9:24,,
1239,,12/1/11 7:39 AM (-06:00),,,12/1/11 10:43 AM (-05:00),
1277,10:15 AM_ Dec 01,10:19 AM_ Dec 01,Terminal D - D1,12:10 PM_ Dec 01,11:50 AM_ Dec 01,T11
1310,,12/1/11 4:29 PM (-06:00),,,12/1/11 7:37 PM (-05:00),
1348,7:15 PM_ Dec 01,,,12:21 AM_ Dec 02,,
1369,2011-12-01 8:05,2011-12-01 8:00,,2011-12-01 11:35,2011-12-01 11:32,
1383,,12/1/11 4:10 PM (-05:00),,,12/1/11 6:25 PM (-05:00),
1386,2011-12-01 04:00PM EST,2011-12-01 04:10PM EST,,2011-12-01 06:34PM EST,2011-12-01 06:23PM EST,
1420,6:00 AM_ Dec 01,6:11 AM_ Dec 01,Terminal 3 - 2,6:40 AM_ Dec 01,6:19 AM_ Dec 01,Terminal T4 - 44F
1429,2011-12-01 6:00,2011-12-01 6:10,,2011-12-01 6:40,2011-12-01 6:19,
1467,,9:01 AMDec 01,,,10:56 AMDec 01,
1485,06:59 AM  Thu 01-Dec-2011,07:22 AM  Thu 01-Dec-2011,B8,10:34 AM  Thu 01-Dec-2011,10:04 AM  Thu 01-Dec-2011,D21
1498,6:59aDec 1,6:56aDec 1,8,10:34aDec 1,10:04aDec 1,D21
1499,2011-12-01 6:59,2011-12-01 7:23,,2011-12-01 10:34,2011-12-01 9:56,
1508,,2011-12-01 8:56,B29,,2011-12-01 10:16,H12
1514,,8:56 AMDec 01,,,10:10 AMDec 01,
1518,Dec 01 - 8:35am,Dec 01 - 8:32am,B29,Dec 01 - 10:40am,Dec 01 - 10:16am,H12/T3
1558,2011-12-01 15:35,2011-12-01 15:36,,2011-12-01 16:00,2011-12-01 15:33,
1570,,12/1/2011 7:22AM CST,,,12/1/2011 10:34AM EST,
1625,2011-12-01 07:10AM EST,2011-12-01 07:31AM EST,D3,2011-12-01 09:00AM CST,2011-12-01 09:26AM CST,K9
1640,7:10aDec 1,7:10aDec 1,D3,9:35aDec 1,9:31aDec 1,K9
1644,2011-12-01 07:10AM EST,2011-12-01 07:31AM EST,D3,2011-12-01 09:00AM CST,2011-12-01 09:26AM CST,K9
1712,,,,2011-12-01 18:15,,80
1727,2011-12-01 11:50,2011-12-01 12:12,,2011-12-01 15:50,2011-12-01 16:09,
1737,11:50aDec 1,11:54aDec 1,D16,3:50pDec 1,4:09pDec 1,A9
1739,2011-12-01 11:50,,D16,,,
1770,2011-12-01 04:00PM CST,2011-12-01 04:12PM CST,A29,2011-12-01 06:30PM CST,2011-12-01 06:11PM CST,G13
1774,2011-12-01 16:00,2011-12-01 16:12,,2011-12-01 18:40,2011-12-01 18:15,
1830,2011-12-01 23:55,2011-12-01 12:10 AM (Estimated runway),,2011-12-01 5:50,2011-12-01 5:42 AM (Estimated runway),
1845,12/01/2011 07:10 AM,12/01/2011 07:16 AM,A29,12/01/2011 09:40 AM,12/01/2011 09:32 AM,H5
1903,12/1/11 9:15 AM (-05:00),,,12/1/11 12:18 PM (-05:00),,
1939,Dec 01 - Not Available,Dec 01 - 1:50pm,75,Dec 01 - Not Available,Dec 01 - 8:02am,100
1979,,8:26 AMDec 01,,,9:54 AMDec 01,
1986,,12/1/11 8:07 AM (-08:00),,,12/1/11 1:23 PM (-06:00),
2084,2011-12-01 8:35,2011-12-01 8:51,,2011-12-01 11:50,2011-12-01 11:44,
2117,7:00pDec 1,7:14pDec 1,E8,10:15pDec 1,10:02pDec 1,33
2131,2011-12-01 15:05,2011-12-01 15:36,,2011-12-01 18:30,2011-12-01 18:43,
2140,Dec 01 - 3:05pm,Dec 01 - 3:09pm,Aug-39,Dec 01 - 6:30pm,Dec 01 - 6:43pm,56A
2152,,12/1/11 6:56 PM (-06:00),,,12/1/11 8:38 PM (-05:00),
2206,,12/1/11 11:29 PM (-08:00),,,12/2/11 6:35 AM (-05:00),
2212,11:25 PM  Thu 01-Dec-2011,,,06:55 AM  Fri 02-Dec-2011,,
2248,12:10pDec 1,12:01pDec 1,1,2:15pDec 1,1:43pDec 1,32G
2260,2011-12-01 12:15PM CST,2011-12-01 12:42PM CST,G19,2011-12-01 02:35PM MST,2011-12-01 02:40PM MST,A3
2266,2011-12-01 12:15,2011-12-01 12:41,,2011-12-01 14:45,2011-12-01 14:50,
2282,,12/1/11 10:11 AM (-06:00),,,12/1/11 1:11 PM (-05:00),
2349,,11:47 AMDec 01,,,2:02 PMDec 01,
2398,7:45 PM_ Dec 01,7:59 PM_ Dec 01,,10:30 PM_ Dec 01,,
2414,7:45 PM_ Dec 01,7:59 PM_ Dec 01,,10:30 PM_ Dec 01,,
2418,7:45 PM_ Dec 01,7:59 PM_ Dec 01,,10:30 PM_ Dec 01,10:29 PM_ Dec 01&nbsp(Estimated),
2429,2011-12-01 19:45,,,2011-12-01 22:30,,
2456,2011-12-01 9:45,,,2011-12-01 13:16,,
2480,2011-12-01 11/30 4:16 PM,,B36,2011-12-01 11/30 7:35 PM,,C23
2495,2011-12-01 23:08,,,2011-12-01 5:11,,
2500,11:08 PMDec 01,,,5:11 AMDec 02,,
2513,2011-12-01 01:29PM EST,2011-12-01 02:01PM EST,126,2011-12-01 03:55PM EST,2011-12-01 04:06PM EST,39
2515,,2011-12-01 13:48,126,,2011-12-01 16:17,39
2523,,2:01 PMDec 01,,,4:17 PMDec 01,
2532,,12/1/11 10:54 AM (-05:00),,,12/1/11 1:36 PM (-05:00),
2601,,9:00 AMDec 02,,,9:42 AMDec 02,
2610,2011-12-02 8:41,2011-12-02 8:36,,2011-12-02 9:54,2011-12-02 9:42,
2615,,12/2/11 1:46 PM (-06:00),,,12/2/11 3:43 PM (-08:00),
2618,,12/2/11 1:46 PM (-06:00),,,12/2/11 3:43 PM (-08:00),
2627,1:30 PM_ Dec 02,,,3:50 PM_ Dec 02,,
2633,2011-12-02 13:30,2011-12-02 13:46,,2011-12-02 15:50,2011-12-02 15:43,
2666,2011-12-02 12:40PM EST,2011-12-02 12:55PM EST,C17,2011-12-02 03:09PM PST,2011-12-02 03:11PM PST,75B
2688,,12:55 PMDec 02,,,3:24 PMDec 02,
2701,,12:55 PMDec 02,,,3:24 PMDec 02,
2815,6:00 AM_ Dec 02,6:26 AM_ Dec 02,E14,7:30 AM_ Dec 02,7:32 AM_ Dec 02,H5
2836,2011-12-02 6:30,2011-12-02 6:54,,2011-12-02 9:15,2011-12-02 9:26,
2838,6:30 AM_ Dec 02,6:55 AM_ Dec 02,Terminal D - D3,9:15 AM_ Dec 02,9:26 AM_ Dec 02,Terminal 8 - 5
2839,6:30 AM_ Dec 02,6:55 AM_ Dec 02,,9:15 AM_ Dec 02,9:26 AM_ Dec 02,
2856,2011-12-02 04:55PM EST,2011-12-02 05:28PM EST,D44,2011-12-02 07:34PM MST,2011-12-02 08:00PM MST,6
2910,2011-12-02 18:30,2011-12-02 6:46 PM (Estimated runway),,2011-12-02 19:25,2011-12-02 7:24 PM (Estimated runway),
2914,6:30 PM_ Dec 02,Not Available,,7:25 PM_ Dec 02,Not Available,
2922,,12/2/11 11:40 AM (-00:00),,,12/2/11 2:32 PM (-05:00),
2929,,11:35 AMDec 02,,,2:56 PMDec 02,
2949,2011-12-02 11:05,2011-12-02 11:02,,2011-12-02 16:57,2011-12-02 16:44,
2979,11:55 AM_ Dec 02,12:15 PM_ Dec 02,Terminal 4,6:17 PM_ Dec 02,6:17 PM_ Dec 02,A10
3029,2011-12-02 11:40,2011-12-02 12:00,,2011-12-02 13:17,2011-12-02 13:18,
3033,,12/2/11 12:11 PM (-05:00),,,12/2/11 1:22 PM (-05:00),
3066,,10:52 AMDec 02,,,11:17 AMDec 02,
3102,01:00 PM  Fri 02-Dec-2011,01:29 PM  Fri 02-Dec-2011,C2,02:35 PM  Fri 02-Dec-2011,02:51 PM  Fri 02-Dec-2011,4
3154,2011-12-02 03:50PM EST,2011-12-02 03:58PM EST,,2011-12-02 06:13PM EST,2011-12-02 05:59PM EST,
3179,03:27 PM  Fri 02-Dec-2011,03:23 PM  Fri 02-Dec-2011,57,05:05 PM  Fri 02-Dec-2011,04:59 PM  Fri 02-Dec-2011,C12
3244,,12/2/11 3:02 PM (-06:00),,,12/2/11 6:39 PM (-05:00),
3259,2011-12-02 14:30,,,2011-12-02 19:03,,
3315,2011-12-02 12:57,2011-12-02 13:08,,2011-12-02 17:15,2011-12-02 17:07,
3363,10:40 AM  Fri 02-Dec-2011,10:53 AM  Fri 02-Dec-2011,H15,02:45 PM  Fri 02-Dec-2011,02:26 PM  Fri 02-Dec-2011,D1
3381,12/2/11 2:30 PM (-06:00),,,12/2/11 7:03 PM (-05:00),,
3394,,3:02 PMDec 02,,,7:08 PMDec 02,
3406,2011-12-02 07:10AM EST,2011-12-02 07:47AM EST,39,2011-12-02 10:12AM PST,2011-12-02 10:23AM PST,58B
3438,,4:17 PMDec 02,,,5:26 PMDec 02,
3452,2011-12-02 09:00PM PST,2011-12-02 09:06PM PST,,2011-12-02 11:48PM MST,2011-12-02 11:54PM MST,
3458,2011-12-02 21:00,2011-12-02 9:06 PM (Estimated runway),,2011-12-02 0:15,2011-12-02 11:54 PM (Estimated runway),
3469,,,,2011-12-02 0:15,,A49
3489,7:55 AM_ Dec 02,8:08 AM_ Dec 02,B16,11:05 AM_ Dec 02,10:56 AM_ Dec 02,Terminal 2
3507,2011-12-02 14:35,2011-12-02 14:42,,2011-12-02 16:05,2011-12-02 15:46,
3521,2011-12-02 02:35PM EST,2011-12-02 02:42PM EST,A7,2011-12-02 03:55PM CST,2011-12-02 03:36PM CST,G1B
3555,,2011-12-02 7:30,,,2011-12-02 8:59,76B
3572,,12/2/11 10:52 AM (-06:00),,,12/2/11 12:36 PM (-05:00),
3638,7:15 AM_ Dec 02,7:21 AM_ Dec 02,Terminal 3,11:35 AM_ Dec 02,11:08 AM_ Dec 02,H15
3641,7:15 AM_ Dec 02,7:21 AM_ Dec 02,Terminal 3,11:35 AM_ Dec 02,11:08 AM_ Dec 02,H15
3729,,2011-12-02 5:57,75B,,2011-12-02 7:12,88
3739,,6:08 AMDec 02,,,7:04 AMDec 02,
3757,,9:02 PMDec 02,,,10:03 PMDec 02,
3762,7:10pDec 2,8:49pDec 2,40,11:16pDec 2,,60
3803,7:25 AM_ Dec 02,7:48 AM_ Dec 02,,11:10 AM_ Dec 02,11:13 AM_ Dec 02,
3806,7:25 AM_ Dec 02,7:48 AM_ Dec 02,,11:10 AM_ Dec 02,11:02 AM_ Dec 02,
3832,10:15 AM_ Dec 02,10:39 AM_ Dec 02,Terminal D - D36,12:10 PM_ Dec 02,12:15 PM_ Dec 02,T11
3835,10:15aDec 2,10:18aDec 2,D36,12:10pDec 2,12:18pDec 2,T11
3840,12/2/11 10:25 AM (-08:00),,,12/2/11 6:44 PM (-05:00),,
3890,12/2/11 7:15 PM (-08:00),,,12/3/11 12:21 AM (-06:00),,
3926,,8:21 AMDec 02,,,11:33 AMDec 02,
3977,6:00 AM_ Dec 02,6:07 AM_ Dec 02,,6:40 AM_ Dec 02,6:05 AM_ Dec 02,
3994,2011-12-02 20:25,2011-12-02 8:29 PM (Estimated runway),,2011-12-02 23:50,2011-12-02 11:23 PM (Estimated runway),
4003,8:25pDec 2,,C27,11:50pDec 2,,D32
4010,12/2/11 8:40 AM (-05:00),,,12/2/11 10:54 AM (-06:00),,
4039,2011-12-02 6:59,2011-12-02 7:36,,2011-12-02 10:34,2011-12-02 10:15,
4076,Fri._ Dec.02_ 2011 6:00 a.m.,Fri._ Dec.02_ 2011 5:58 a.m.,,Fri._ Dec.02_ 2011 10:20 a.m.,Fri._ Dec.02_ 2011 10:14 a.m.,
4116,,4:48 PMDec 02,,,4:37 PMDec 02,
4123,,12/2/11 7:37 AM (-06:00),,,12/2/11 10:51 AM (-05:00),
4127,2011-12-02 07:15AM CST,2011-12-02 07:38AM CST,C36,2011-12-02 10:14AM EST,2011-12-02 10:51AM EST,14
4256,02:30 PM  Fri 02-Dec-2011,02:27 PM  Fri 02-Dec-2011,9,06:15 PM  Fri 02-Dec-2011,05:46 PM  Fri 02-Dec-2011,G92
4259,2011-12-02 14:30,2011-12-02 14:27,,2011-12-02 18:15,2011-12-02 17:46,
4275,,12/2/11 12:00 PM (-06:00),,,12/2/11 3:37 PM (-05:00),
4320,12/02/2011 04:00 PM,12/02/2011 04:17 PM,A29,12/02/2011 06:40 PM,12/02/2011 06:14 PM,G5
4374,12/2/2011 11:55PM PST,,,12/3/2011 5:50AM CST,,
4472,Dec 02 - 9:15am,Dec 02 - 9:12am,C74,Dec 02 - 12:18pm,Dec 02 - 12:22pm,39
4484,,2011-12-02 13:35,D75,,2011-12-02 8:06,G97
4511,,3:19 PMDec 02,,,5:00 PMDec 02,
4512,,3:19 PMDec 02,,,4:56 PMDec 02,
4521,,12/2/11 8:31 AM (-05:00),,,12/2/11 10:05 AM (-06:00),
4523,,2011-12-02 8:15,D20,,2011-12-02 10:08,E6
4570,2011-12-02 17:25,2011-12-02 17:26,,2011-12-02 20:22,2011-12-02 20:29,
4612,2011-12-02 12:00,2011-12-02 12:14,,2011-12-02 15:15,2011-12-02 15:08,
4633,08:35 AM  Fri 02-Dec-2011,08:52 AM  Fri 02-Dec-2011,D40,11:50 AM  Fri 02-Dec-2011,11:41 AM  Fri 02-Dec-2011,56A
4641,8:35 AM_ Dec 02,8:52 AM_ Dec 02,D40,11:50 AM_ Dec 02,11:41 AM_ Dec 02,Terminal 2 - 56A
4642,8:35 AM_ Dec 02,8:52 AM_ Dec 02,D40,11:50 AM_ Dec 02,11:41 AM_ Dec 02,Terminal 2 - 56A
4671,2011-12-02 19:00,2011-12-02 19:13,,2011-12-02 22:15,2011-12-02 22:25,
4680,2011-12-02 03:05PM EST,2011-12-02 03:41PM EST,5,2011-12-02 05:57PM PST,2011-12-02 06:37PM PST,58B
4735,07:30 AM  Fri 02-Dec-2011,07:57 AM  Fri 02-Dec-2011,1,08:00 AM  Fri 02-Dec-2011,07:56 AM  Fri 02-Dec-2011,G12
4741,7:30 AM_ Dec 02,7:58 AM_ Dec 02,Terminal 2,8:00 AM_ Dec 02,7:53 AM_ Dec 02,G12
4779,Dec 02 - 11:25pm,Dec 02 - Not Available,43/T4,Dec 03 - 6:55am,Dec 03 - Not Available,14
4783,,12/2/2011 12:22PM EST,,,12/2/2011 1:51PM EST,
4793,2011-12-02 12:10,2011-12-02 12:22,,2011-12-02 14:15,2011-12-02 13:52,
4808,,12/2/11 12:30 PM (-06:00),,,12/2/11 2:42 PM (-07:00),
4809,,12/2/11 12:30 PM (-06:00),,,12/2/11 2:42 PM (-07:00),
4824,12:15 PM_ Dec 02,12:30 PM_ Dec 02,H3A,2:45 PM_ Dec 02,2:42 PM_ Dec 02,A3
4883,Fri_ Dec 2 11:15 AM,Fri_ Dec 2 11:15 AM,D14,Fri_ Dec 2 1:40 PM,Fri_ Dec 2 1:40 PM,A6
4893,,11:27 AMDec 02,,,1:38 PMDec 02,
4938,07:45 PM  Fri 02-Dec-2011,,H14,10:30 PM  Fri 02-Dec-2011,,6
4940,07:45 PM  Fri 02-Dec-2011,,H14,10:30 PM  Fri 02-Dec-2011,,6
4951,7:45 PM_ Dec 02,7:56 PM_ Dec 02,,10:30 PM_ Dec 02,,
4960,7:45 PM_ Dec 02,7:56 PM_ Dec 02,,10:30 PM_ Dec 02,,
4979,7:45pDec 2,7:38pDec 2,H14,10:22pDec 2,,6
4980,7:45pDec 2,7:38pDec 2,H14,10:34pDec 2,,6
5057,12/2/11 1:29 PM (-05:00),,,12/2/11 4:17 PM (-05:00),,
5063,12/2/11 1:29 PM (-05:00),,,12/2/11 4:17 PM (-05:00),,
5121,2011-12-02 07:35AM CST,2011-12-02 08:07AM CST,,2011-12-02 09:11AM PST,2011-12-02 09:18AM PST,
5124,12/3/11 2:55 PM (-05:00),,,12/3/11 4:53 PM (-05:00),,
5144,2011-12-03 14:55,2011-12-03 14:49,,2011-12-03 16:53,2011-12-03 16:29,
5154,,2011-12-03 10:17,A2,,2011-12-03 11:17,
5166,8:41aDec 3,10:17aDec 3,A2A,9:54aDec 3,11:17aDec 3,-
5172,12/3/2011 1:30PM CST,,,12/3/2011 3:50PM PST,,
5179,01:30 PM  Sat 03-Dec-2011,,H11B,03:50 PM  Sat 03-Dec-2011,,7
5222,2011-12-03 12:30PM EST,2011-12-03 12:46PM EST,C17,2011-12-03 02:50PM PST,2011-12-03 02:56PM PST,75B
5236,2011-12-03 12:30,2011-12-03 12:31,,2011-12-03 15:19,2011-12-03 15:03,
5272,,12:46 PMDec 03,,,2:54 PMDec 03,
5305,07:10 AM  Sat 03-Dec-2011,07:21 AM  Sat 03-Dec-2011,42B,03:30 PM  Sat 03-Dec-2011,03:13 PM  Sat 03-Dec-2011,B35
5327,07:00 AM  Sat 03-Dec-2011,07:17 AM  Sat 03-Dec-2011,1,09:55 AM  Sat 03-Dec-2011,09:40 AM  Sat 03-Dec-2011,D60
5331,2011-12-03 7:00,2011-12-03 7:17,,2011-12-03 9:55,2011-12-03 9:40,
5332,2011-12-03 7:00,2011-12-03 7:17,,2011-12-03 9:55,2011-12-03 9:40,
5333,7:00 AM_ Dec 03,7:17 AM_ Dec 03,Terminal 2,9:55 AM_ Dec 03,9:40 AM_ Dec 03,Terminal D - D60
5345,,12/3/2011 6:16AM CST,,,12/3/2011 7:06AM CST,
5412,,5:12 PMDec 03,,,8:01 PMDec 03,
5442,,12/3/11 6:47 PM (-05:00),,,12/3/11 7:25 PM (-05:00),
5457,Dec 03 - 6:30pm,Dec 03 - Not Available,D43,Dec 03 - 7:25pm,Dec 03 - Not Available,14
5469,,2011-12-03 9:26,,,2011-12-03 13:17,126
5471,,9:37 AMDec 03,,,1:17 PMDec 03,
5495,11:05 AM_ Dec 03,11:18 AM_ Dec 03,,4:57 PM_ Dec 03,4:44 PM_ Dec 03,
5542,,11:40 AMDec 03,,,4:51 PMDec 03,
5579,12:00 PM  Sat 03-Dec-2011,11:50 AM  Sat 03-Dec-2011,C21,01:45 PM  Sat 03-Dec-2011,01:18 PM  Sat 03-Dec-2011,B6
5595,Dec 03 - 12:00noon,Dec 03 - Contact Airline,Not provided by airline,Dec 03 - 1:45pm,Dec 03 - Contact Airline,Not provided by airline
5629,,12:50 AMDec 03,,,5:28 AMDec 03,
5630,,12:50 AMDec 03,,,5:28 AMDec 03,
5632,,12:50 AMDec 03,,,5:28 AMDec 03,
5673,03:50 PM  Sat 03-Dec-2011,03:53 PM  Sat 03-Dec-2011,B15,06:23 PM  Sat 03-Dec-2011,06:19 PM  Sat 03-Dec-2011,58
5730,,,,2011-12-03 14:35,,A49
5743,2011-12-03 14:30,2011-12-03 14:52,,2011-12-03 19:01,2011-12-03 18:57,
5749,2011-12-03 14:30,,,2011-12-03 19:01,,
5763,10:40 AM_ Dec 03,11:25 AM_ Dec 03,K9,2:45 PM_ Dec 03,3:12 PM_ Dec 03,Terminal D - D2
5778,12/3/11 2:30 PM (-06:00),,,12/3/11 7:01 PM (-05:00),,
5784,2011-12-03 14:30,2011-12-03 14:52,,2011-12-03 19:01,2011-12-03 18:57,
5811,7:10 AM_ Dec 03,7:32 AM_ Dec 03,,10:45 AM_ Dec 03,10:24 AM_ Dec 03,
5839,,3:04 PMDec 03,,,4:17 PMDec 03,
5936,7:35 AM_ Dec 03,7:35 AM_ Dec 03,,9:43 AM_ Dec 03,8:50 AM_ Dec 03,
5944,,12/3/11 10:58 AM (-06:00),,,12/3/11 12:44 PM (-05:00),
5951,10:40 AM  Sat 03-Dec-2011,10:57 AM  Sat 03-Dec-2011,G2B,12:55 PM  Sat 03-Dec-2011,12:55 PM  Sat 03-Dec-2011,A1
6037,2011-12-03 14:53,,,2011-12-03 16:48,,
6063,2011-12-03 Sat  20:00,,15?,,,
6065,12/03/2011 11:35 AM,12/03/2011 11:55 AM,D8,12/03/2011 02:25 PM,12/03/2011 02:22 PM,46B
6117,,12/3/11 8:03 AM (-06:00),,,12/3/11 11:22 AM (-05:00),
6124,07:25 AM  Sat 03-Dec-2011,08:03 AM  Sat 03-Dec-2011,D25,11:10 AM  Sat 03-Dec-2011,11:28 AM  Sat 03-Dec-2011,D3
6135,7:25aDec 3,7:43aDec 3,D25,11:10aDec 3,11:28aDec 3,D3
6136,2011-12-03 7:25,2011-12-03 8:04,,2011-12-03 11:10,2011-12-03 11:20,
6158,Dec 03 - 10:15am,Dec 03 - 10:11am,D17,Dec 03 - 12:10pm,Dec 03 - 12:11pm,T11
6188,,12/3/11 4:40 PM (-06:00),,,12/3/11 7:57 PM (-05:00),
6191,,12/3/11 4:40 PM (-06:00),,,12/3/11 7:57 PM (-05:00),
6257,4:00pDec 3,3:52pDec 3,-,6:46pDec 3,6:47pDec 3,-
6274,2011-12-03 6:00,2011-12-03 6:07,,2011-12-03 6:40,2011-12-03 6:18,
6305,8:25 PM_ Dec 03,,,11:50 PM_ Dec 03,,
6311,2011-12-03 20:25,,C8,,,
6333,2011-12-03 8:40,,,2011-12-03 10:54,,
6350,6:59 AM_ Dec 03,7:15 AM_ Dec 03,,10:34 AM_ Dec 03,9:44 AM_ Dec 03,
6353,6:59 AM_ Dec 03,7:15 AM_ Dec 03,,10:34 AM_ Dec 03,9:37 AM_ Dec 03,
6360,12/03/2011 08:35 AM,12/03/2011 08:48 AM,B36,12/03/2011 10:40 AM,12/03/2011 10:13 AM,K5
6392,2011-12-03 6:00,2011-12-03 5:54,,2011-12-03 10:20,2011-12-03 10:13,
6430,,12/3/11 7:27 AM (-06:00),,,12/3/11 10:39 AM (-05:00),
6443,Dec 03 - 7:15am,Dec 03 - 7:14am,C15/C,Dec 03 - 10:35am,Dec 03 - 10:39am,14
6473,10:50aDec 3,10:48aDec 3,C4,2:59pDec 3,3:11pDec 3,44
6504,,12/3/11 11:58 AM (-06:00),,,12/3/11 1:38 PM (-05:00),
6534,02:30 PM  Sat 03-Dec-2011,02:24 PM  Sat 03-Dec-2011,12,06:07 PM  Sat 03-Dec-2011,05:34 PM  Sat 03-Dec-2011,80
6545,Dec 03 - Not Available,Dec 03 - 2:43pm,12,Dec 03 - Not Available,Dec 03 - 5:34pm,80
6550,2011-12-03 14:30,2011-12-03 14:24,,2011-12-03 18:07,2011-12-03 17:34,
6552,2011-12-03 02:30PM EST,2011-12-03 02:43PM EST,12,2011-12-03 05:47PM PST,2011-12-03 05:20PM PST,80
6555,,12/3/11 12:10 PM (-06:00),,,12/3/11 3:45 PM (-05:00),
6585,,12/3/11 4:15 PM (-06:00),,,12/3/11 6:06 PM (-06:00),
6603,2011-12-03 16:00,,29,2011-12-03 18:40,,G9
6620,11:55 PM_ Dec 03,,Terminal 2,5:50 AM_ Dec 04,,Terminal 3
6646,7:10 AM_ Dec 03,7:10 AM_ Dec 03,A29,9:40 AM_ Dec 03,9:01 AM_ Dec 03,Terminal 3
6752,Sat._ Dec.03_ 2011 5:25 p.m.,Sat._ Dec.03_ 2011 5:23 p.m.,,Sat._ Dec.03_ 2011 8:19 p.m.,Sat._ Dec.03_ 2011 8:14 p.m.,
6755,2011-12-03 05:25PM EST,2011-12-03 05:34PM EST,C81,2011-12-03 08:09PM CST,2011-12-03 07:52PM CST,39
6788,11:25aDec 3,11:36aDec 3,B18,2:47pDec 3,3:17pDec 3,C-32
6790,2011-12-03 11:25,,B18,,,
6791,2011-12-03 11:25,2011-12-03 11:36,,2011-12-03 14:47,2011-12-03 15:17,
6829,2011-12-03 8:35,2011-12-03 8:43,,2011-12-03 11:50,2011-12-03 11:19,
6913,8:05 PM_ Dec 03,8:23 PM_ Dec 03,,10:20 PM_ Dec 03,10:05 PM_ Dec 03,
6963,11:25 PM_ Dec 03,,,6:55 AM_ Dec 04,,
6980,2011-12-03 12:10PM EST,2011-12-03 12:17PM EST,1,2011-12-03 02:05PM EST,2011-12-03 01:36PM EST,32H
6988,12:10 PM_ Dec 03,12:17 PM_ Dec 03,Terminal 2,2:15 PM_ Dec 03,2:03 PM_ Dec 03,Terminal 8 - 32H
6998,12:10 PM_ Dec 03,12:17 PM_ Dec 03,,2:15 PM_ Dec 03,1:57 PM_ Dec 03,
7001,,12/3/11 12:23 PM (-06:00),,,12/3/11 2:21 PM (-07:00),
7080,12/3/11 11:15 AM (-05:00),,,12/3/11 1:40 PM (-07:00),,
7107,,12/3/11 7:59 PM (-06:00),,,12/3/11 10:34 PM (-07:00),
7119,,12/3/11 7:59 PM (-06:00),,,12/3/11 10:34 PM (-07:00),
7158,7:45 PM_ Dec 03,7:59 PM_ Dec 03,,10:30 PM_ Dec 03,,
7192,09:00 AM  Sat 03-Dec-2011,09:02 AM  Sat 03-Dec-2011,A6,12:31 PM  Sat 03-Dec-2011,12:25 PM  Sat 03-Dec-2011,33
7194,2011-12-03 9:00,2011-12-03 9:02,,2011-12-03 12:31,2011-12-03 12:25,
7230,3:55pDec 3,4:01pDec 3,B36,7:15pDec 3,7:24pDec 3,B11
7249,10:59 PM_ Dec 03,,Terminal 3 - 74,5:14 AM_ Dec 04,,C29
7253,10:59pDec 3,,74,5:14aDec 4,,C29
7266,2011-12-03 01:45PM EST,2011-12-03 02:03PM EST,113,2011-12-03 04:10PM EST,2011-12-03 04:14PM EST,39
7304,12/3/11 7:35 AM (-06:00),,,12/3/11 9:21 AM (-08:00),,
7330,,2011-12-04 14:48,37,,2011-12-04 16:32,D3
7335,,3:05 PMDec 04,,,4:30 PMDec 04,
7343,2011-12-04 14:55,2011-12-04 14:48,,2011-12-04 16:53,2011-12-04 16:32,
7349,,12/4/11 8:50 AM (-05:00),,,12/4/11 9:19 AM (-05:00),
7370,,12/4/11 1:39 PM (-06:00),,,12/4/11 3:45 PM (-08:00),
7374,2011-12-04 01:30PM CST,2011-12-04 01:39PM CST,H17,2011-12-04 03:36PM PST,2011-12-04 03:45PM PST,7
7409,,12/4/11 12:41 PM (-05:00),,,12/4/11 3:16 PM (-08:00),
7437,2011-12-04 12:30,2011-12-04 12:29,,2011-12-04 15:19,2011-12-04 14:50,
7452,,12:41 PMDec 04,,,2:47 PMDec 04,
7453,,12:41 PMDec 04,,,2:47 PMDec 04,
7489,2011-12-04 20:20,,,2011-12-04 21:20,,
7521,,12/4/11 7:09 AM (-05:00),,,12/4/11 9:29 AM (-05:00),
7538,2011-12-04 7:00,,,2011-12-04 9:55,,
7544,,12/4/11 6:32 AM (-06:00),,,12/4/11 7:32 AM (-06:00),
7547,2011-12-04 06:00AM CST,2011-12-04 06:31AM CST,E14,2011-12-04 07:20AM CST,2011-12-04 07:32AM CST,G13
7569,,12/4/11 7:02 AM (-05:00),,,12/4/11 9:20 AM (-05:00),
7572,2011-12-04 06:30AM EST,2011-12-04 07:02AM EST,D1,2011-12-04 08:52AM EST,2011-12-04 09:11AM EST,3
7585,6:30 AM_ Dec 04,7:02 AM_ Dec 04,,9:15 AM_ Dec 04,9:22 AM_ Dec 04,
7588,2011-12-04 6:30,2011-12-04 7:02,,2011-12-04 9:15,2011-12-04 9:29,
7592,,12/4/2011 5:12PM EST,,,12/4/2011 7:46PM MST,
7673,,12/4/11 11:33 AM (-07:00),,,12/4/11 5:00 PM (-05:00),
7681,2011-12-04 11:05,2011-12-04 11:13,,2011-12-04 16:57,2011-12-04 17:09,
7683,11:05 AM_ Dec 04,11:34 AM_ Dec 04,,4:57 PM_ Dec 04,5:01 PM_ Dec 04,
7705,2011-12-04 11:55,2011-12-04 11:54,,2011-12-04 18:17,2011-12-04 11:36 PM (Estimated),
7715,11:55 AM_ Dec 04,Not Available,,6:17 PM_ Dec 04,Not Available,
7735,,11:47 AMDec 04,,,5:19 PMDec 04,
7761,11:40aDec 4,11:41aDec 4,E9,1:16pDec 4,1:06pDec 4,B18
7799,12/4/11 12:30 AM (-08:00),,,12/4/11 5:35 AM (-06:00),,
7821,,12/4/11 1:32 PM (-06:00),,,12/4/11 2:43 PM (-07:00),
7823,2011-12-04 01:00PM CST,2011-12-04 01:31PM CST,C7,2011-12-04 02:17PM MST,2011-12-04 02:43PM MST,4
7886,3:50 PM_ Dec 04,4:04 PM_ Dec 04,,6:23 PM_ Dec 04,6:01 PM_ Dec 04,
7929,2011-12-04 13:05,2011-12-04 13:14,,2011-12-04 14:35,2011-12-04 14:44,
7942,1:05 PM_ Dec 04,1:15 PM_ Dec 04,,2:35 PM_ Dec 04,2:37 PM_ Dec 04,
7963,12/4/2011 5:57PM CST,,,12/4/2011 6:36PM CST,,
7993,Sun_ Dec 4 12:47 PM,Sun_ Dec 4 12:47 PM,3,Sun_ Dec 4 5:15 PM,Sun_ Dec 4 4:56 PM,C28
8042,,2:57 PMDec 04,,,6:43 PMDec 04,
8051,,2:57 PMDec 04,,,6:43 PMDec 04,
8108,12/4/11 2:30 PM (-06:00),,,12/4/11 7:03 PM (-05:00),,
8129,2011-12-04 07:10AM EST,2011-12-04 07:33AM EST,39,2011-12-04 10:12AM PST,2011-12-04 10:26AM PST,58B
8173,12/4/2011 9:00PM PST,,,12/5/2011 12:15AM MST,,
8181,09:00 PM  Sun 04-Dec-2011,,44,12:15 AM  Mon 05-Dec-2011,,A49
8233,02:35 PM  Sun 04-Dec-2011,02:57 PM  Sun 04-Dec-2011,7,04:05 PM  Sun 04-Dec-2011,03:54 PM  Sun 04-Dec-2011,H3A
8236,2011-12-04 14:35,2011-12-04 14:57,,2011-12-04 16:05,2011-12-04 15:54,
8257,2011-12-04 01:20PM CST,2011-12-04 01:37PM CST,C29,2011-12-04 04:08PM EST,2011-12-04 04:10PM EST,D9
8265,1:20 PM_ Dec 04,1:37 PM_ Dec 04,C29,4:25 PM_ Dec 04,4:17 PM_ Dec 04,D9
8273,2011-12-04 13:20,,C29,2011-12-04 16:25,,D9
8276,1:20 PM_ Dec 04,1:37 PM_ Dec 04,,4:25 PM_ Dec 04,4:14 PM_ Dec 04,
8296,12/04/2011 10:40 AM,12/04/2011 10:53 AM,G6A,12/04/2011 12:55 PM,12/04/2011 12:46 PM,A1
8312,10:40 AM_ Dec 04,10:54 AM_ Dec 04,,12:55 PM_ Dec 04,12:45 PM_ Dec 04,
8371,Dec 04 - 7:15am,Dec 04 - 7:07am,03-Apr,Dec 04 - 11:35am,Dec 04 - 11:11am,K16/T3
8387,2011-12-04 14:53,2011-12-04 15:02,,2011-12-04 16:48,2011-12-04 16:50,
8547,2011-12-04 07:25AM CST,2011-12-04 11:19AM CST,D25,2011-12-04 10:41AM EST,2011-12-04 02:36PM EST,D2
8579,,2011-12-04 10:23,60,,2011-12-04 18:24,82
8599,,12/4/11 4:55 PM (-06:00),,,12/4/11 8:15 PM (-05:00),
8610,4:15 PM_ Dec 04,4:57 PM_ Dec 04,D27,7:55 PM_ Dec 04,8:24 PM_ Dec 04,Terminal E - E7
8631,07:15 PM  Sun 04-Dec-2011,,,12:21 AM  Mon 05-Dec-2011,,
8644,2011-12-04 19:15,,,2011-12-04 0:21,,
8723,2011-12-04 08:25PM CST,2011-12-04 08:29PM CST,,2011-12-04 11:19PM EST,2011-12-04 11:23PM EST,
8741,Sun._ Dec.04_ 2011 8:40 a.m.,Sun._ Dec.04_ 2011 9:08 a.m.,,Sun._ Dec.04_ 2011 10:54 a.m.,Sun._ Dec.04_ 2011 11:18 a.m.,
8750,2011-12-04 8:40,2011-12-04 9:08,,2011-12-04 10:54,2011-12-04 11:18,
8756,,9:17 AMDec 04,,,11:09 AMDec 04,
8783,,,,10:34A 12-04-11,2011-12-04  9:58A,
8825,,6:12 AMDec 04,,,10:11 AMDec 04,
8860,,12/4/2011 9:40AM CST,,,12/4/2011 12:41PM EST,
8904,10:40 AM_ Dec 04,11:02 AM_ Dec 04,C14,2:59 PM_ Dec 04,3:02 PM_ Dec 04,Terminal 8 - 33
8915,,12/4/2011 7:49AM EST,,,12/4/2011 9:29AM CST,
8923,07:10 AM  Sun 04-Dec-2011,07:49 AM  Sun 04-Dec-2011,D2,09:35 AM  Sun 04-Dec-2011,09:35 AM  Sun 04-Dec-2011,L8
8969,,2011-12-04 12:00,G3,,2011-12-04 13:54,D28
9025,2011-12-04 11:50,2011-12-04 11:59,,2011-12-04 15:50,2011-12-04 15:42,
9085,2011-12-04 16:00,,,2011-12-04 18:40,,
9087,4:00pDec 4,3:55pDec 4,A29,6:40pDec 4,6:34pDec 4,H3A
9158,7:10 AM_ Dec 04,7:15 AM_ Dec 04,,9:40 AM_ Dec 04,9:12 AM_ Dec 04,
9218,,12/4/11 1:54 PM (+08:00),,,12/4/11 8:19 AM (-08:00),
9221,,2011-12-04 13:33,D77,,2011-12-04 8:35,G92
9245,,3:41 PMDec 04,,,5:00 PMDec 04,
9289,,8:05 AMDec 04,,,1:42 PMDec 04,
9315,,5:34 PMDec 04,,,7:57 PMDec 04,
9370,,12/4/11 8:52 AM (-05:00),,,12/4/11 11:28 AM (-08:00),
9385,8:35 AM_ Dec 04,8:52 AM_ Dec 04,D44,11:50 AM_ Dec 04,11:37 AM_ Dec 04,Terminal 2 - 57
9411,,7:53 PMDec 04,,,10:40 PMDec 04,
9438,Dec 04 - 3:05pm,Dec 04 - 3:04pm,Aug-43,Dec 04 - 6:30pm,Dec 04 - 6:29pm,57
9447,,12/4/2011 7:04PM CST,,,12/4/2011 8:49PM EST,
9457,2011-12-04 06:45PM CST,2011-12-04 07:04PM CST,H4,2011-12-04 08:49PM EST,2011-12-04 08:49PM EST,D28
9479,,12/4/11 7:32 AM (-05:00),,,12/4/11 7:23 AM (-06:00),
9510,2011-12-04 23:25,2011-12-04 11:29 PM (Estimated runway),,2011-12-04 6:55,2011-12-04 6:40 AM (Estimated runway),
9511,2011-12-04 23:25,2011-12-04 11:29 PM (Estimated runway),,2011-12-04 6:55,2011-12-04 6:40 AM (Estimated runway),
9537,2011-12-04 12:10,2011-12-04 13:28,,2011-12-04 14:15,2011-12-04 15:05,
9588,2011-12-04 14:55,2011-12-04 15:15,,2011-12-04 17:55,2011-12-04 17:41,
9640,2011-12-04 07:45PM CST,2011-12-04 08:02PM CST,H8,2011-12-04 10:14PM MST,2011-12-04 10:28PM MST,6
9695,,2011-12-04 16:15,B44,,2011-12-04 19:35,C26
9721,11:12 PM  Sun 04-Dec-2011,,,05:15 AM  Mon 05-Dec-2011,,
9737,2011-12-04 12/3 10:59 PM,,74,2011-12-04 5:14,,B8
9749,,2011-12-04 13:43,136,,2011-12-04 16:15,39
9750,,2011-12-04 13:43,136,,2011-12-04 16:15,39
9773,,11:04 AMDec 04,,,1:47 PMDec 04,
9887,,12/5/11 12:48 PM (-05:00),,,12/5/11 3:02 PM (-08:00),
9923,,12:48 PMDec 05,,,2:44 PMDec 05,
9946,12:30pDec 5,12:31pDec 5,C27,3:19pDec 5,3:06pDec 5,73
9952,2011-12-05 12:30,2011-12-05 12:31,,2011-12-05 15:19,2011-12-05 15:06,
9979,,8:30 PMDec 05,,,8:53 PMDec 05,
9991,07:10 AM  Mon 05-Dec-2011,07:13 AM  Mon 05-Dec-2011,42B,03:30 PM  Mon 05-Dec-2011,02:55 PM  Mon 05-Dec-2011,B31
10017,07:00 AM  Mon 05-Dec-2011,07:23 AM  Mon 05-Dec-2011,1,09:55 AM  Mon 05-Dec-2011,09:47 AM  Mon 05-Dec-2011,D60
10030,7:00 AM_ Dec 05,7:23 AM_ Dec 05,,9:55 AM_ Dec 05,9:38 AM_ Dec 05,
10062,2011-12-05 06:30AM EST,2011-12-05 06:50AM EST,D24,2011-12-05 08:49AM EST,2011-12-05 09:01AM EST,33
10073,6:30 AM_ Dec 05,6:51 AM_ Dec 05,Terminal D - D24,9:15 AM_ Dec 05,9:20 AM_ Dec 05,Terminal 8
10101,,5:01 PMDec 05,,,7:55 PMDec 05,
10130,06:30 PM  Mon 05-Dec-2011,,D33,07:25 PM  Mon 05-Dec-2011,,14
10133,2011-12-05 18:30,2011-12-05 6:48 PM (Estimated runway),,2011-12-05 19:25,2011-12-05 7:26 PM (Estimated runway),
10162,Dec 05 - 9:05am,Dec 05 - Contact Airline,Not provided by airline,Dec 05 - 11:53am,Dec 05 - Contact Airline,Not provided by airline
10201,11:55 AM  Mon 05-Dec-2011,11:53 AM  Mon 05-Dec-2011,A6,06:17 PM  Mon 05-Dec-2011,05:48 PM  Mon 05-Dec-2011,12
10211,Dec 05 - 11:55am,Dec 05 - Contact Airline,Not provided by airline,Dec 05 - 6:17pm,Dec 05 - Contact Airline,Not provided by airline
10271,2011-12-05 12:00,2011-12-05 12:30,,2011-12-05 13:45,2011-12-05 13:50,
10298,10:39 AM_ Dec 05,10:45 AM_ Dec 05,,11:19 AM_ Dec 05,11:11 AM_ Dec 05,
10391,2011-12-05 03:50PM EST,2011-12-05 04:58PM EST,,2011-12-05 06:14PM EST,2011-12-05 06:58PM EST,
10405,3:50pDec 5,4:44pDec 5,-,6:23pDec 5,7:04pDec 5,-
10433,,12/5/11 7:19 AM (-06:00),,,12/5/11 10:20 AM (-05:00),
10440,2011-12-05 7:05,2011-12-05 7:04,,2011-12-05 10:31,2011-12-05 10:28,
10450,2011-12-05 7:05,,,2011-12-05 10:31,,
10463,01:05 PM  Mon 05-Dec-2011,01:27 PM  Mon 05-Dec-2011,K9,02:35 PM  Mon 05-Dec-2011,02:48 PM  Mon 05-Dec-2011,A49
10514,2011-12-05 17:30,,1,2011-12-05 18:40,,E29
10563,,2011-12-05 13:10,3,,2011-12-05 17:12,C17
10575,2011-12-05 12:57,2011-12-05 13:10,,2011-12-05 17:15,2011-12-05 17:12,
10594,,1:20 PMDec 05,,,5:12 PMDec 05,
10628,10:40 AM_ Dec 05,10:53 AM_ Dec 05,K13,2:45 PM_ Dec 05,2:37 PM_ Dec 05,Terminal D - D40
10639,12/5/11 2:30 PM (-06:00),,,12/5/11 7:03 PM (-05:00),,
10675,7:10 AM_ Dec 05,7:50 AM_ Dec 05,Terminal 8 - 36,10:45 AM_ Dec 05,10:45 AM_ Dec 05,Terminal 2 - 58B
10685,Mon._ Dec.05_ 2011 2:55 p.m.,Mon._ Dec.05_ 2011 3:35 p.m.,,Mon._ Dec.05_ 2011 4:49 p.m.,Mon._ Dec.05_ 2011 6:05 p.m.,
10688,12/5/11 2:55 PM (-05:00),,,12/5/11 4:49 PM (-05:00),,
10689,12/5/11 2:55 PM (-05:00),,,12/5/11 4:49 PM (-05:00),,
10693,2011-12-05 14:55,2011-12-05 15:35,,2011-12-05 16:49,2011-12-05 18:05,
10699,,4:42 PMDec 05,,,6:05 PMDec 05,
10714,09:00 PM  Mon 05-Dec-2011,,44,12:15 AM  Tue 06-Dec-2011,,A49
10732,12/05/2011 07:55 AM,12/05/2011 08:31 AM,B21,12/05/2011 11:05 AM,12/05/2011 11:17 AM,3
10770,2011-12-05 14:35,2011-12-05 14:40,,2011-12-05 16:05,2011-12-05 15:45,
10771,2011-12-05 14:35,2011-12-05 14:40,,2011-12-05 16:05,2011-12-05 15:45,
10785,2011-12-05 14:35,2011-12-05 14:40,,2011-12-05 16:05,2011-12-05 15:45,
10789,,12/5/11 2:13 PM (-06:00),,,12/5/11 4:50 PM (-05:00),
10826,,7:49 AMDec 05,,,9:38 AMDec 05,
10852,10:40 AM_ Dec 05,10:48 AM_ Dec 05,,12:55 PM_ Dec 05,12:43 PM_ Dec 05,
10856,2011-12-05 10:40,,G7,2011-12-05 12:55,,A1
10871,8:00 AM_ Dec 05,8:11 AM_ Dec 05,8,11:55 AM_ Dec 05,11:24 AM_ Dec 05,Terminal 3 - 81
10885,,12/5/11 7:19 AM (-07:00),,,12/5/11 11:11 AM (-06:00),
10928,12/05/2011 08:00 PM,12/05/2011 08:06 PM,15,12/05/2011 09:50 PM,12/05/2011 09:29 PM,K4
10941,2011-12-05 20:00,2011-12-05 20:06,,2011-12-05 21:50,2011-12-05 21:29,
10988,2011-12-05 6:00,2011-12-05 5:56,,2011-12-05 7:23,2011-12-05 7:09,
10993,,6:06 AMDec 05,,,7:09 AMDec 05,
11029,,2011-12-05 8:49,C26,,2011-12-05 10:26,D7
11050,,12/4/11 11:19 AM (-06:00),,,12/5/11 11:55 AM (-05:00),
11059,2011-12-05 7:25,2011-12-05 8:37,,2011-12-05 11:10,2011-12-05 12:00,
11075,,12/5/2011 10:43AM EST,,,12/5/2011 12:18PM EST,
11141,4:30pDec 5,4:24pDec 5,D17,7:55pDec 5,7:52pDec 5,D34
11150,12/5/11 8:05 AM (-07:00),,,12/5/11 11:35 AM (-06:00),,
11161,,8:18 AMDec 05,,,11:30 AMDec 05,
11193,2011-12-05 16:00,2011-12-05 15:52,,2011-12-05 18:46,2011-12-05 18:13,
11198,,12/5/11 6:17 AM (-07:00),,,12/5/11 6:23 AM (-08:00),
11245,Mon._ Dec.05_ 2011 8:40 a.m.,Mon._ Dec.05_ 2011 8:40 a.m.,,Mon._ Dec.05_ 2011 10:54 a.m.,Mon._ Dec.05_ 2011 11:49 a.m.,
11257,,8:55 AMDec 05,,,11:49 AMDec 05,
11332,,12/5/2011 4:51PM EST,,,12/5/2011 4:42PM CST,
11340,2011-12-05 03:35PM EST,2011-12-05 04:51PM EST,5,2011-12-05 03:50PM CST,2011-12-05 04:42PM CST,G19A
11342,,2011-12-05 16:51,5,,2011-12-05 16:47,G19A
11368,2011-12-05 7:15,2011-12-05 7:27,,2011-12-05 10:35,2011-12-05 10:39,
11371,7:15 AM_ Dec 05,7:28 AM_ Dec 05,,10:35 AM_ Dec 05,10:32 AM_ Dec 05,
11375,Dec 05 - 7:15am,Dec 05 - 7:15am,C30/C,Dec 05 - 10:35am,Dec 05 - 10:39am,17
11386,,12/5/11 11:07 AM (-06:00),,,12/5/11 2:33 PM (-05:00),
11411,,12/5/11 7:29 AM (-05:00),,,12/5/11 9:11 AM (-06:00),
11416,2011-12-05 07:10AM EST,2011-12-05 07:29AM EST,D1,2011-12-05 08:52AM CST,2011-12-05 09:11AM CST,L8
11420,2011-12-05 7:10,2011-12-05 7:29,,2011-12-05 9:35,2011-12-05 9:23,
11425,7:10 AM_ Dec 05,7:29 AM_ Dec 05,,9:35 AM_ Dec 05,9:13 AM_ Dec 05,
11441,,2011-12-05 14:31,77,,2011-12-05 20:22,C15
11498,2:30 PM_ Dec 05,2:49 PM_ Dec 05,12,6:15 PM_ Dec 05,5:34 PM_ Dec 05,Terminal 3 - 80
11514,2011-12-05 11:50AM CST,2011-12-05 12:06PM CST,D16,2011-12-05 03:29PM EST,2011-12-05 03:43PM EST,A9
11532,2011-12-05 11:50,2011-12-05 12:06,,2011-12-05 15:50,2011-12-05 15:44,
11589,,12/5/11 4:27 PM (-08:00),,,12/5/11 11:53 PM (-05:00),
11593,2011-12-05 04:25PM PST,2011-12-05 04:27PM PST,72,2011-12-05 11:51PM EST,2011-12-05 11:53PM EST,8
11603,4:25 PM_ Dec 05,,72,12:29 AM_ Dec 06,,8
11666,12/05/2011 06:45 AM,12/05/2011 06:56 AM,D33,12/05/2011 07:45 AM,12/05/2011 07:51 AM,16
11688,2011-12-05 6:45,2011-12-05 6:56,,2011-12-05 7:45,2011-12-05 7:37,
11700,09:15 AM  Mon 05-Dec-2011,09:40 AM  Mon 05-Dec-2011,88,12:18 PM  Mon 05-Dec-2011,12:52 PM  Mon 05-Dec-2011,39
11702,2011-12-05 9:15,2011-12-05 9:40,,2011-12-05 12:18,2011-12-05 12:52,
11726,1:45 PMDec 05,,,8:27 AMDec 05,,
11764,2011-12-05 8:17,2011-12-05 8:12,,2011-12-05 10:08,2011-12-05 9:51,
11766,,8:25 AMDec 05,,,9:51 AMDec 05,
11780,,12/5/11 8:06 AM (-08:00),,,12/5/11 1:13 PM (-06:00),
11810,,6:44 PMDec 05,,,9:15 PMDec 05,
11814,Mon._ Dec.05_ 2011 11:25 a.m.,Mon._ Dec.05_ 2011 11:28 a.m.,,Mon._ Dec.05_ 2011 2:50 p.m.,Mon._ Dec.05_ 2011 2:53 p.m.,
11839,,12/5/11 12:03 PM (-05:00),,,12/5/11 2:43 PM (-08:00),
11862,,12/5/11 8:51 AM (-05:00),,,12/5/11 11:07 AM (-08:00),
11925,3:05 PM_ Dec 05,3:32 PM_ Dec 05,Terminal 8 - 33,6:30 PM_ Dec 05,6:17 PM_ Dec 05,Terminal 2 - 58B
11949,6:45 PM_ Dec 05,7:09 PM_ Dec 05,Terminal 3,9:10 PM_ Dec 05,9:06 PM_ Dec 05,Terminal N
11980,7:30 AM_ Dec 05,7:48 AM_ Dec 05,,8:00 AM_ Dec 05,7:40 AM_ Dec 05,
12026,12:10 PM_ Dec 05,12:19 PM_ Dec 05,Terminal 2,2:15 PM_ Dec 05,2:01 PM_ Dec 05,Terminal 8 - 32I
12040,,12/5/11 12:30 PM (-06:00),,,12/5/11 2:29 PM (-07:00),
12056,12:15 PM_ Dec 05,12:30 PM_ Dec 05,G9,2:45 PM_ Dec 05,2:29 PM_ Dec 05,A3
12081,9:05 AM_ Dec 05,9:18 AM_ Dec 05,,12:35 PM_ Dec 05,12:14 PM_ Dec 05,
12099,02:55 PM  Mon 05-Dec-2011,03:09 PM  Mon 05-Dec-2011,C43,05:55 PM  Mon 05-Dec-2011,05:36 PM  Mon 05-Dec-2011,16
12117,Mon_ Dec 5 11:15 AM,Mon_ Dec 5 11:15 AM,D14,Mon_ Dec 5 1:40 PM,Mon_ Dec 5 2:00 PM,A6
12120,,12/5/11 11:38 AM (-05:00),,,12/5/11 1:48 PM (-07:00),
12138,12/05/2011 07:45 PM,12/05/2011 07:53 PM,H10,12/05/2011 10:30 PM,,6
12199,7:45pDec 5,7:40pDec 5,H10,9:56pDec 5,,6
12240,2011-12-05 16:16,2011-12-05 16:19,,2011-12-05 19:35,2011-12-05 19:40,
12257,,12/5/11 11:13 PM (-08:00),,,12/6/11 4:57 AM (-06:00),
12315,,10:56 AMDec 05,,,2:01 PMDec 05,
12335,,2011-12-05 7:37,40,,2011-12-05 9:32,
12376,,2011-12-07 15:01,37,,2011-12-07 17:12,C13
12387,Dec 07 - 2:55pm,Dec 07 - Contact Airline,Not provided by airline,Dec 07 - 4:53pm,Dec 07 - Contact Airline,Not provided by airline
12436,Dec 07 - 1:30pm,Dec 07 - Not Available,K8/T3,Dec 07 - 3:50pm,Dec 07 - Not Available,7
12445,12/7/11 8:40 AM (-05:00),,,12/7/11 10:54 AM (-06:00),,
12466,2011-12-07 8:40,,,2011-12-07 10:54,,
12491,2011-12-07 6:59,2011-12-07 7:11,,2011-12-07 10:34,2011-12-07 9:59,
12531,,2011-12-07 12:44,C11,,2011-12-07 15:19,73
12573,2011-12-07 12:30,2011-12-07 12:44,,2011-12-07 15:19,2011-12-07 15:06,
12617,2011-12-07 7:10,2011-12-07 7:22,,2011-12-07 15:30,2011-12-07 15:29,
12622,7:10 AM_ Dec 07,7:23 AM_ Dec 07,Terminal 4 - 48B,3:30 PM_ Dec 07,3:29 PM_ Dec 07,Terminal B - B28
12627,2011-12-07 7:10,,,2011-12-07 15:30,,
12629,2011-12-07 07:10AM PST,2011-12-07 07:22AM PST,48B,2011-12-07 03:03PM EST,2011-12-07 03:22PM EST,B28
12637,2011-12-07 07:00AM EST,2011-12-07 07:25AM EST,3,2011-12-07 09:57AM EST,2011-12-07 09:44AM EST,D60N
12675,2011-12-07 8:35,,B35,2011-12-07 10:40,,H10
12686,,2011-12-07 5:59,10,,2011-12-07 10:06,128
12693,,6:13 AMDec 07,,,10:06 AMDec 07,
12714,6:00 AM_ Dec 07,6:26 AM_ Dec 07,E14,7:30 AM_ Dec 07,7:25 AM_ Dec 07,H5
12761,2011-12-07 10:40,2011-12-07 10:52,,2011-12-07 14:59,2011-12-07 14:50,
12773,10:40aDec 7,10:37aDec 7,C8,2:59pDec 7,2:50pDec 7,33
12803,,12/7/11 7:23 AM (-05:00),,,12/7/11 8:58 AM (-06:00),
12807,2011-12-07 07:10AM EST,2011-12-07 07:23AM EST,D40,2011-12-07 08:48AM CST,2011-12-07 08:55AM CST,K13
12815,7:10 AM_ Dec 07,7:23 AM_ Dec 07,Terminal D - D40,9:35 AM_ Dec 07,9:01 AM_ Dec 07,K13
12826,2011-12-07 7:10,2011-12-07 7:23,,2011-12-07 9:35,2011-12-07 8:54,
12889,2:10pDec 7,2:12pDec 7,75B,7:53pDec 7,7:40pDec 7,C19
12895,,12/7/11 6:48 PM (-05:00),,,12/7/11 7:26 PM (-05:00),
12896,,12/7/11 6:48 PM (-05:00),,,12/7/11 7:26 PM (-05:00),
12898,2011-12-07 06:30PM EST,2011-12-07 06:40PM EST,D43,2011-12-07 07:05PM EST,2011-12-07 07:15PM EST,14
12948,2011-12-07 11:45,2011-12-07 11:54,,2011-12-07 14:00,2011-12-07 13:54,
12969,11:05 AM  Wed 07-Dec-2011,11:10 AM  Wed 07-Dec-2011,A14,04:57 PM  Wed 07-Dec-2011,05:14 PM  Wed 07-Dec-2011,B5
12978,11:05 AM_ Dec 07,11:31 AM_ Dec 07,,4:57 PM_ Dec 07,5:07 PM_ Dec 07,
13001,11:55 AM_ Dec 07,1:04 PM_ Dec 07,,6:17 PM_ Dec 07,6:17 PM_ Dec 07,
13028,Dec 07 - Not Available,Dec 07 - 2:51pm,9,Dec 07 - Not Available,Dec 07 - 5:47pm,80
13058,,12/7/11 1:40 PM (-06:00),,,12/7/11 5:20 PM (-05:00),
13091,11:40 AM  Wed 07-Dec-2011,11:37 AM  Wed 07-Dec-2011,1,01:17 PM  Wed 07-Dec-2011,01:12 PM  Wed 07-Dec-2011,B22
13108,2011-12-07 11:40,,,2011-12-07 13:17,,
13114,2011-12-07 04:00PM EST,2011-12-07 04:31PM EST,C88,2011-12-07 06:55PM EST,2011-12-07 07:18PM EST,G19
13125,,4:09 PMDec 07,,,7:27 PMDec 07,
13170,10:39 AM_ Dec 07,11:48 AM_ Dec 07,,11:19 AM_ Dec 07,12:13 PM_ Dec 07,
13171,10:39 AM_ Dec 07,11:48 AM_ Dec 07,,11:19 AM_ Dec 07,12:13 PM_ Dec 07,
13204,2011-12-07 01:00PM CST,2011-12-07 01:17PM CST,C16,2011-12-07 02:05PM MST,2011-12-07 02:24PM MST,4
13207,01:00 PM  Wed 07-Dec-2011,01:16 PM  Wed 07-Dec-2011,C16,02:35 PM  Wed 07-Dec-2011,02:29 PM  Wed 07-Dec-2011,4
13211,2011-12-07 13:00,2011-12-07 13:16,,2011-12-07 14:35,2011-12-07 14:29,
13230,04:00 PM  Wed 07-Dec-2011,04:15 PM  Wed 07-Dec-2011,29,06:40 PM  Wed 07-Dec-2011,06:44 PM  Wed 07-Dec-2011,G3
13257,04:25 PM  Wed 07-Dec-2011,,,12:29 AM  Thu 08-Dec-2011,,
13266,4:25 PM_ Dec 07,,70B,12:29 AM_ Dec 08,,9
13287,2011-12-07 6:00,2011-12-07 6:10,,2011-12-07 9:20,2011-12-07 9:11,
13327,,12/7/11 3:58 PM (-05:00),,,12/7/11 4:58 PM (-05:00),
13331,03:27 PM  Wed 07-Dec-2011,03:43 PM  Wed 07-Dec-2011,58,05:05 PM  Wed 07-Dec-2011,05:25 PM  Wed 07-Dec-2011,C12
13380,2011-12-07 7:05,2011-12-07 7:11,,2011-12-07 10:31,2011-12-07 10:53,
13400,2011-12-07 01:05PM CST,2011-12-07 01:12PM CST,K9,2011-12-07 02:16PM MST,2011-12-07 02:21PM MST,A49
13406,2011-12-07 13:05,2011-12-07 13:11,,2011-12-07 14:35,2011-12-07 14:29,
13425,12/7/11 2:30 PM (-06:00),,,12/7/11 7:03 PM (-05:00),,
13439,2011-12-07 14:30,,,2011-12-07 19:03,,
13483,2011-12-07 17:30,,1,2011-12-07 18:40,,E29
13487,5:30 PMDec 07,,,6:40 PMDec 07,,
13516,6:45 AM_ Dec 07,6:52 AM_ Dec 07,Terminal D - D48,7:45 AM_ Dec 07,7:27 AM_ Dec 07,17
13543,,12/7/11 1:10 PM (-07:00),,,12/7/11 5:03 PM (-06:00),
13573,12:57 PMDec 07,,,5:10 PMDec 07,,
13593,2011-12-07 12:57,,3,2011-12-07 17:15,,C23
13601,2011-12-07 12:57,2011-12-07 13:02,,2011-12-07 17:15,2011-12-07 17:09,
13611,10:40 AM  Wed 07-Dec-2011,10:50 AM  Wed 07-Dec-2011,H15,02:45 PM  Wed 07-Dec-2011,02:34 PM  Wed 07-Dec-2011,D1
13636,2011-12-07 09:15AM EST,2011-12-07 10:09AM EST,134,2011-12-07 12:08PM EST,2011-12-07 12:46PM EST,39
13643,9:15 AM_ Dec 07,10:09 AM_ Dec 07,Term C - C134,12:18 PM_ Dec 07,12:53 PM_ Dec 07,Term B - 39
13655,12/7/11 2:30 PM (-06:00),,,12/7/11 7:03 PM (-05:00),,
13694,7:10aDec 7,7:06aDec 7,33,10:45aDec 7,10:45aDec 7,58B
13701,2011-12-07 7:10,2011-12-07 7:40,,2011-12-07 10:45,2011-12-07 10:45,
13745,,,,2011-12-07 0:15,,A49
13777,,3:42 PMDec 07,,,5:00 PMDec 07,
13898,,2011-12-07 7:25,,,2011-12-07 9:42,69
13960,,12/7/11 8:20 AM (-05:00),,,12/7/11 11:10 AM (-08:00),
13975,8:00 AM_ Dec 07,8:20 AM_ Dec 07,9,11:55 AM_ Dec 07,11:22 AM_ Dec 07,Terminal 3 - 87
14069,7:15 AM_ Dec 07,7:25 AM_ Dec 07,,11:35 AM_ Dec 07,11:25 AM_ Dec 07,
14075,2011-12-07 07:15AM MST,2011-12-07 07:25AM MST,6,2011-12-07 11:16AM CST,2011-12-07 11:20AM CST,H12
14114,2011-12-07 14:53,2011-12-07 14:54,,2011-12-07 16:45,2011-12-07 16:33,
14116,,3:05 PMDec 07,,,4:33 PMDec 07,
14175,3:05 PM_ Dec 07,4:39 PM_ Dec 07,,6:30 PM_ Dec 07,7:29 PM_ Dec 07,
14208,,12/7/11 6:59 PM (-06:00),,,12/7/11 8:42 PM (-05:00),
14217,6:45 PM_ Dec 07,7:00 PM_ Dec 07,Terminal 3,9:10 PM_ Dec 07,8:48 PM_ Dec 07,Terminal N
14268,7:30 AM_ Dec 07,7:56 AM_ Dec 07,,8:00 AM_ Dec 07,7:42 AM_ Dec 07,
14304,11:25 PMDec 07,,,6:55 AMDec 08,,
14318,,6:12 AMDec 07,,,7:12 AMDec 07,
14346,,7:48 PMDec 07,,,8:56 PMDec 07,
14355,,2011-12-07 9:06,C26,,2011-12-07 10:01,D7
14359,,9:23 AMDec 07,,,10:01 AMDec 07,
14367,2011-12-07 8:29,,,2011-12-07 9:24,,
14400,,12/7/2011 12:30PM CST,,,12/7/2011 2:42PM MST,
14426,,12/7/11 9:14 AM (-06:00),,,12/7/11 12:18 PM (-05:00),
14442,9:05 AM_ Dec 07,9:15 AM_ Dec 07,C30,12:35 PM_ Dec 07,12:32 PM_ Dec 07,Terminal N
14514,10:15 AM_ Dec 07,10:27 AM_ Dec 07,Terminal D - D36,12:10 PM_ Dec 07,11:55 AM_ Dec 07,T11
14521,2011-12-07 10:15,2011-12-07 10:27,,2011-12-07 12:10,2011-12-07 11:51,
14522,2011-12-07 10:15,2011-12-07 10:26,,2011-12-07 12:10,2011-12-07 11:59,
14531,,2011-12-07 13:27,62,,2011-12-07 22:17,120
14561,,12/7/11 8:01 PM (-06:00),,,12/7/11 10:33 PM (-07:00),
14585,2011-12-07 19:45,2011-12-07 20:01,,2011-12-07 22:30,2011-12-07 10:29 PM (Estimated),
14591,7:45 PM_ Dec 07,8:01 PM_ Dec 07,,10:30 PM_ Dec 07,,
14616,Dec 07 - 7:45pm,Dec 07 - 7:51pm,H15/T3,Dec 07 - 10:30pm,Dec 07 - 10:29pm*,03-Jun
14632,,12/7/2011 1:29PM EST,,,12/7/2011 4:49PM CST,
14633,12/7/11 9:45 AM (-05:00),,,12/7/11 1:16 PM (-06:00),,
14653,,12/7/11 4:26 PM (-07:00),,,12/7/11 7:25 PM (-06:00),
14674,Dec 07 - Not Available,Dec 07 - 4:27pm,B36,Dec 07 - Not Available,Dec 07 - 7:24pm,C25
14747,12/7/11 7:15 PM (-08:00),,,12/8/11 12:21 AM (-06:00),,
14770,,12/7/2011 8:10AM MST,,,12/7/2011 11:15AM CST,
14788,2011-12-07 8:05,,,2011-12-07 11:35,,
14807,4:00 PM_ Dec 07,4:19 PM_ Dec 07,Terminal 3 - E3,6:46 PM_ Dec 07,6:28 PM_ Dec 07,B5
14822,2011-12-07 06:00AM MST,2011-12-07 06:17AM MST,,2011-12-07 06:11AM PST,2011-12-07 06:15AM PST,
14834,6:00 AM_ Dec 07,6:17 AM_ Dec 07,,6:40 AM_ Dec 07,6:16 AM_ Dec 07,
14835,Dec 07 - 6:00am,Dec 07 - 5:59am,2,Dec 07 - 6:40am,Dec 07 - 6:25am,44J/T4
14859,2011-12-07 07:35AM CST,2011-12-07 11:07AM CST,,2011-12-07 09:00AM PST,2011-12-07 12:17PM PST,
14860,,11:07 AMDec 07,,,12:14 PMDec 07,
14882,2:55pDec 8,2:49pDec 8,-,4:53pDec 8,4:50pDec 8,-
14921,1:30 PM_ Dec 08,,H14,3:50 PM_ Dec 08,,Terminal A - 7
14923,1:30 PM_ Dec 08,,H14,3:50 PM_ Dec 08,,Terminal A - 7
14951,,12/8/11 12:43 PM (-05:00),,,12/8/11 3:00 PM (-08:00),
14966,,2011-12-08 12:25,C11,,2011-12-08 15:19,75B
14968,,2011-12-08 12:25,C11,,2011-12-08 15:13,75B
15000,,12:43 PMDec 08,,,2:50 PMDec 08,
15035,8:20pDec 8,8:10pDec 8,A3,9:20pDec 8,9:03pDec 8,44F
15042,,12/8/11 7:29 AM (-08:00),,,12/8/11 3:05 PM (-05:00),
15085,Dec 08 - 7:00am,Dec 08 - 6:58am,5,Dec 08 - 9:55am,Dec 08 - 9:51am,D53
15106,2011-12-08 6:00,2011-12-08 6:11 AM (runway),,2011-12-08 7:30,2011-12-08 7:03 AM (runway),
15116,2011-12-08 6:00,,E14,2011-12-08 7:30,,H5
15143,6:30aDec 8,6:26aDec 8,D1,9:15aDec 8,8:56aDec 8,33
15153,2011-12-08 04:55PM EST,2011-12-08 05:21PM EST,D12,2011-12-08 07:52PM MST,2011-12-08 08:08PM MST,6
15171,12/8/11 8:55 AM (-06:00),,,12/8/11 11:45 AM (-06:00),,
15184,12/8/2011 6:30PM EST,,,12/8/2011 7:25PM EST,,
15188,,12/8/11 6:48 PM (-05:00),,,12/8/11 7:26 PM (-05:00),
15189,2011-12-08 06:30PM EST,2011-12-08 06:48PM EST,D33,2011-12-08 07:08PM EST,2011-12-08 07:26PM EST,14
15252,,12/8/11 12:04 PM (-07:00),,,12/8/11 5:49 PM (-05:00),
15281,,12/8/11 11:34 AM (-08:00),,,12/8/11 5:02 PM (-06:00),
15283,,2011-12-08 11:18,27,,2011-12-08 17:12,K5
15292,Dec 08 - 11:25am,Dec 08 - 11:18am,27/T2,Dec 08 - 5:25pm,Dec 08 - 5:12pm,K5/T3
15322,,12/8/11 12:16 PM (-05:00),,,12/8/11 1:34 PM (-05:00),
15369,2011-12-08 10:39,,,2011-12-08 11:19,,
15370,Thu._ Dec.08_ 2011 12:30 a.m.,Thu._ Dec.08_ 2011 12:25 a.m.,,Thu._ Dec.08_ 2011 5:35 a.m.,Thu._ Dec.08_ 2011 5:09 a.m.,
15393,,12/8/11 1:10 PM (-06:00),,,12/8/11 2:25 PM (-07:00),
15395,,12/8/11 1:10 PM (-06:00),,,12/8/11 2:25 PM (-07:00),
15481,3:27 PM_ Dec 08,3:50 PM_ Dec 08,,5:05 PM_ Dec 08,5:04 PM_ Dec 08,
15487,3:27pDec 8,3:31pDec 8,-,5:05pDec 8,5:10pDec 8,-
15531,1:05pDec 8,1:00pDec 8,H8,2:35pDec 8,2:48pDec 8,A49
15534,2011-12-08 13:05,,H8,2011-12-08 14:35,,A49
15552,,4:44 PMDec 08,,,8:31 PMDec 08,
15558,,4:44 PMDec 08,,,8:31 PMDec 08,
15560,12/8/2011 5:49PM CST,,,12/8/2011 6:35PM CST,,
15565,,12/8/11 5:37 PM (-06:00),,,12/8/11 6:18 PM (-06:00),
15601,,12/8/11 1:03 PM (-07:00),,,12/8/11 4:54 PM (-06:00),
15647,12:57 PMDec 08,,,5:15 PMDec 08,,
15661,,12/8/11 10:51 AM (-06:00),,,12/8/11 2:46 PM (-05:00),
15721,7:10 AM_ Dec 08,7:32 AM_ Dec 08,,10:45 AM_ Dec 08,10:41 AM_ Dec 08,
15750,December 8_ 2011               09:00 PM,December 8_ 2011,44J,December 9_ 2011               12:15 AM,December 9_ 2011,A49
15789,2011-12-08 7:55,2011-12-08 8:06 AM (runway),,2011-12-08 11:05,2011-12-08 10:46 AM (runway),
15838,01:33 PM  Thu 08-Dec-2011,01:31 PM  Thu 08-Dec-2011,C23,04:31 PM  Thu 08-Dec-2011,04:26 PM  Thu 08-Dec-2011,D11
15866,,7:35 AMDec 08,,,9:03 AMDec 08,
15871,7:35aDec 8,,-,9:43aDec 8,,-
15897,2011-12-08 10:40,,G6B,2011-12-08 12:55,,A1
15902,,12/8/11 8:17 AM (-05:00),,,12/8/11 11:13 AM (-08:00),
15908,08:00 AM  Thu 08-Dec-2011,07:58 AM  Thu 08-Dec-2011,10,11:55 AM  Thu 08-Dec-2011,11:36 AM  Thu 08-Dec-2011,82
15909,08:00 AM  Thu 08-Dec-2011,07:58 AM  Thu 08-Dec-2011,10,11:55 AM  Thu 08-Dec-2011,11:36 AM  Thu 08-Dec-2011,82
15928,,12/8/11 7:21 AM (-07:00),,,12/8/11 11:11 AM (-06:00),
15961,,3:13 PMDec 08,,,4:38 PMDec 08,
15966,,3:13 PMDec 08,,,4:30 PMDec 08,
15968,2:53pDec 8,2:54pDec 8,G15,4:48pDec 8,4:38pDec 8,25
16004,,12/8/11 11:45 AM (-05:00),,,12/8/11 2:08 PM (-08:00),
16014,11:35 AM_ Dec 08,11:45 AM_ Dec 08,D24,2:25 PM_ Dec 08,2:13 PM_ Dec 08,Terminal 4 - 42B
16034,,6:10 AMDec 08,,,7:15 AMDec 08,
16060,2011-12-08 19:10,2011-12-08 19:12,,2011-12-08 20:56,2011-12-08 20:51,
16073,,12/8/11 8:53 AM (-05:00),,,12/8/11 9:26 AM (-05:00),
16117,7:25 AM_ Dec 08,7:50 AM_ Dec 08,,11:10 AM_ Dec 08,11:09 AM_ Dec 08,
16131,2011-12-08 10:15,2011-12-08 10:29 AM (runway),,2011-12-08 12:10,2011-12-08 11:55 AM (runway),
16197,12/8/11 7:15 PM (-08:00),,,12/9/11 12:21 AM (-06:00),,
16303,2011-12-08 20:25,2011-12-08 8:30 PM (Estimated runway),,2011-12-08 23:50,2011-12-08 11:37 PM (Estimated runway),
16357,6:59 AM_ Dec 08,7:35 AM_ Dec 08,,10:34 AM_ Dec 08,10:09 AM_ Dec 08,
16398,,6:30 AMDec 08,,,10:16 AMDec 08,
16402,,6:30 AMDec 08,,,10:16 AMDec 08,
16406,2011-12-08 6:00,2011-12-08 6:02,,2011-12-08 10:20,2011-12-08 10:16,
16408,December 8_ 2011               03:35 PM,December 8_ 2011               03:27 PM,1,December 8_ 2011               04:00 PM,December 8_ 2011               03:35 PM,G10
16417,,2011-12-08 15:27,1,,2011-12-08 15:35,G10
16423,,3:41 PMDec 08,,,3:34 PMDec 08,
16484,2011-12-08 10:40,,D17,,,
16524,,2:10 PMDec 08,,,7:39 PMDec 08,
16579,2:30 PM_ Dec 08,2:48 PM_ Dec 08,,6:15 PM_ Dec 08,5:49 PM_ Dec 08,
16613,12/8/11 4:00 PM (-05:00),,,12/8/11 7:05 PM (-05:00),,
16625,4:00 PM_ Dec 08,4:22 PM_ Dec 08,Term C - C137,7:05 PM_ Dec 08,7:08 PM_ Dec 08,Terminal Conc G - G19
16639,,12/8/11 4:21 PM (-06:00),,,12/8/11 6:18 PM (-06:00),
16664,,12/8/11 4:27 PM (-08:00),,,12/9/11 12:02 AM (-05:00),
16709,2011-12-08 23:55,2011-12-08 0:05,,2011-12-08 5:50,2011-12-08 5:34,
16711,2011-12-08 23:55,2011-12-08 12:10 AM (Estimated runway),,2011-12-08 5:50,2011-12-08 5:37 AM (Estimated runway),
16726,2011-12-08 7:10,2011-12-08 7:15 AM (runway),,2011-12-08 9:40,2011-12-08 9:12 AM (runway),
16814,,2011-12-08 14:58,D23,,2011-12-08 16:54,C27
16827,Dec 08 - 2:55pm,Dec 08 - Contact Airline,Not provided by airline,Dec 08 - 5:00pm,Dec 08 - Contact Airline,Not provided by airline
16829,Thu_ Dec 8 8:15 AM,Thu_ Dec 8 8:38 AM,D18,Thu_ Dec 8 10:06 AM,Thu_ Dec 8 10:43 AM,E10
16867,Dec 08 - Not Available,Dec 08 - 8:02am,86,Dec 08 - Not Available,Dec 08 - 1:17pm,C16
16898,,2011-12-08 11:24,B22,,2011-12-08 14:40,43
16922,2011-12-08 12:00,2011-12-08 11:54,,2011-12-08 15:15,2011-12-08 15:03,
16925,12:00 PM_ Dec 08,12:14 PM_ Dec 08,Terminal 8 - 42,3:15 PM_ Dec 08,3:03 PM_ Dec 08,Terminal 4 - 47B
16932,12:00pDec 8,11:54aDec 8,42,3:15pDec 8,3:03pDec 8,47B
16970,2011-12-08 07:00PM CST,2011-12-08 07:56PM CST,E10,2011-12-08 09:56PM EST,2011-12-08 10:43PM EST,35
16973,,2011-12-08 19:34,10,,2011-12-08 22:50,35
16979,,7:56 PMDec 08,,,10:50 PMDec 08,
17023,06:45 PM  Thu 08-Dec-2011,06:37 PM  Thu 08-Dec-2011,H2,09:10 PM  Thu 08-Dec-2011,08:57 PM  Thu 08-Dec-2011,D28
17073,11:25 PM  Thu 08-Dec-2011,,,06:55 AM  Fri 09-Dec-2011,,
17079,11:25 PM_ Dec 08,,Terminal 4 - 47A,6:55 AM_ Dec 09,,TBA
17089,December 8_ 2011               12:10 PM,December 8_ 2011               12:02 PM,1,December 8_ 2011               02:15 PM,December 8_ 2011               01:46 PM,32H
17093,,12/8/11 12:12 PM (-05:00),,,12/8/11 1:41 PM (-05:00),
17119,2011-12-08 12:15PM CST,2011-12-08 12:24PM CST,H4,2011-12-08 02:40PM MST,2011-12-08 02:31PM MST,A3
17239,2011-12-08 07:45PM CST,2011-12-08 07:54PM CST,H15,2011-12-08 10:05PM MST,2011-12-08 10:07PM MST,6
17259,7:45 PM_ Dec 08,7:55 PM_ Dec 08,,10:30 PM_ Dec 08,,
17314,,10:28 AMDec 08,,,1:53 PMDec 08,
17351,2011-12-08 11:08PM PST,2011-12-08 11:24PM PST,73,2011-12-08 04:52AM CST,2011-12-08 04:55AM CST,C22
17366,11:08 PMDec 08,,,5:11 AMDec 09,,
17384,,1:47 PMDec 08,,,4:18 PMDec 08,
17408,,,,2:20P 12-08-11,2011-12-08  2:19P,
17447,,3:08 PMDec 09,,,4:41 PMDec 09,
17461,,2011-12-09 8:39,A2,,2011-12-09 9:37,
17462,,2011-12-09 8:39,A2,,2011-12-09 9:37,
17482,,12/9/11 1:45 PM (-06:00),,,12/9/11 3:39 PM (-08:00),
17484,2011-12-09 01:30PM CST,2011-12-09 01:24PM CST,K15,2011-12-09 03:36PM PST,2011-12-09 03:36PM PST,7
17528,,2011-12-09 14:11,C11,,2011-12-09 15:19,77
17529,,2011-12-09 14:11,C11,,2011-12-09 15:19,75B
17531,,2011-12-09 14:11,C11,,2011-12-09 15:19,77
17546,,2:35 PMDec 09,,,4:38 PMDec 09,
17549,,2:35 PMDec 09,,,4:38 PMDec 09,
17550,,2:35 PMDec 09,,,4:38 PMDec 09,
17564,,2:35 PMDec 09,,,4:41 PMDec 09,
17624,2011-12-09 7:10,,,2011-12-09 15:30,,
17633,2011-12-09 07:00AM EST,2011-12-09 07:16AM EST,3,2011-12-09 09:48AM EST,2011-12-09 09:49AM EST,D60
17639,2011-12-09 7:00,2011-12-09 7:01,,2011-12-09 9:55,2011-12-09 10:03,
17666,2011-12-09 6:00,2011-12-09 6:00,,2011-12-09 7:30,2011-12-09 7:36,
17688,06:30 AM  Fri 09-Dec-2011,06:39 AM  Fri 09-Dec-2011,D22,09:15 AM  Fri 09-Dec-2011,09:14 AM  Fri 09-Dec-2011,B8
17745,8:55aDec 9,9:02aDec 9,E15,11:45aDec 9,11:49aDec 9,15
17750,,12/9/11 6:47 PM (-05:00),,,12/9/11 7:25 PM (-05:00),
17759,2011-12-09 18:30,2011-12-09 6:30 PM (Estimated),,2011-12-09 19:25,2011-12-09 7:25 PM (Estimated),
17767,Dec 09 - 6:30pm,Dec 09 - Not Available,D33,Dec 09 - 7:25pm,Dec 09 - Not Available,14
17793,Fri_ Dec 9 11:05 AM,Fri_ Dec 9 11:05 AM,B28,Fri_ Dec 9 4:57 PM,Fri_ Dec 9 4:43 PM,B5
17803,2011-12-09 11:05,2011-12-09 11:01,,2011-12-09 16:57,2011-12-09 16:43,
17887,,12/9/11 12:06 PM (-05:00),,,12/9/11 1:26 PM (-05:00),
17891,2011-12-09 12:00PM EST,2011-12-09 12:06PM EST,,2011-12-09 01:42PM EST,2011-12-09 01:23PM EST,
17949,,12:47 AMDec 09,,,5:13 AMDec 09,
17951,2011-12-09 0:30,,,2011-12-09 5:35,,
17981,,12/9/2011 6:16AM CST,,,12/9/2011 9:13AM EST,
18013,2011-12-09 03:50PM EST,2011-12-09 04:05PM EST,,2011-12-09 06:13PM EST,2011-12-09 06:16PM EST,
18017,03:50 PM  Fri 09-Dec-2011,03:46 PM  Fri 09-Dec-2011,B9,06:23 PM  Fri 09-Dec-2011,06:28 PM  Fri 09-Dec-2011,58
18064,,7:32 AMDec 09,,,10:29 AMDec 09,
18076,December 9_ 2011               01:05 PM,December 9_ 2011               01:02 PM,H12,December 9_ 2011               02:35 PM,December 9_ 2011               02:44 PM,A49
18114,2011-12-09 14:30,2011-12-09 15:01,,2011-12-09 19:03,2011-12-09 19:13,
18144,2011-12-09 17:30,2011-12-09 5:30 PM (Estimated),,2011-12-09 18:40,2011-12-09 6:40 PM (Estimated),
18162,,12/9/11 1:12 PM (-07:00),,,12/9/11 5:18 PM (-06:00),
18175,,12/9/11 1:12 PM (-07:00),,,12/9/11 5:18 PM (-06:00),
18282,07:10 AM  Fri 09-Dec-2011,,C40,10:45 AM  Fri 09-Dec-2011,,58B
18307,2011-12-09 14:55,2011-12-09 14:48,,2011-12-09 16:49,2011-12-09 17:02,
18355,07:55 AM  Fri 09-Dec-2011,07:52 AM  Fri 09-Dec-2011,B10A,11:05 AM  Fri 09-Dec-2011,10:52 AM  Fri 09-Dec-2011,1
18356,2011-12-09 7:55,2011-12-09 7:52,,2011-12-09 11:05,2011-12-09 10:52,
18386,2:35 PM_ Dec 09,2:42 PM_ Dec 09,A7,4:05 PM_ Dec 09,3:45 PM_ Dec 09,H5
18402,,12/9/11 2:24 PM (-06:00),,,12/9/11 5:05 PM (-05:00),
18417,Dec 09 - Not Available,Dec 09 - 2:23pm,C11,Dec 09 - Not Available,Dec 09 - 5:10pm,D9
18471,,12/9/11 8:10 AM (-05:00),,,12/9/11 10:59 AM (-08:00),
18504,07:15 AM  Fri 09-Dec-2011,07:47 AM  Fri 09-Dec-2011,6,11:35 AM  Fri 09-Dec-2011,11:52 AM  Fri 09-Dec-2011,H11A
18530,2011-12-09 14:53,2011-12-09 15:16,,2011-12-09 16:45,2011-12-09 16:55,
18558,8:00 PM_ Dec 09,8:14 PM_ Dec 09,,9:50 PM_ Dec 09,9:32 PM_ Dec 09,
18562,Dec 09 - 8:00pm,Dec 09 - 8:03pm,15,Dec 09 - 9:50pm,Dec 09 - 9:31pm,H11B/T3
18649,,9:37 AMDec 09,,,10:34 AMDec 09,
18667,07:25 AM  Fri 09-Dec-2011,07:25 AM  Fri 09-Dec-2011,D36,11:10 AM  Fri 09-Dec-2011,10:56 AM  Fri 09-Dec-2011,D3
18682,2011-12-09 7:25,2011-12-09 7:38,,2011-12-09 11:10,2011-12-09 10:50,
18699,10:15 AM_ Dec 09,10:34 AM_ Dec 09,Terminal D - D45,12:10 PM_ Dec 09,12:09 PM_ Dec 09,T11
18704,Dec 09 - 10:15am,Dec 09 - 10:16am,D45,Dec 09 - 12:10pm,Dec 09 - 12:10pm,T11
18721,,12:05 PMDec 09,,,8:11 PMDec 09,
18734,,12/9/11 4:47 PM (-06:00),,,12/9/11 8:06 PM (-05:00),
18761,12/9/11 7:15 PM (-08:00),,,12/10/11 12:21 AM (-06:00),,
18803,,12/9/11 4:06 PM (-05:00),,,12/9/11 6:01 PM (-05:00),
18807,2011-12-09 04:00PM EST,2011-12-09 04:05PM EST,,2011-12-09 06:36PM EST,2011-12-09 06:18PM EST,
18808,2011-12-09 04:00PM EST,2011-12-09 04:05PM EST,,2011-12-09 06:36PM EST,2011-12-09 06:18PM EST,
18829,,12/9/11 6:12 AM (-07:00),,,12/9/11 6:15 AM (-08:00),
18865,2011-12-09 20:25,2011-12-09 8:25 PM (Estimated),,2011-12-09 23:50,2011-12-09 11:50 PM (Estimated),
18889,2011-12-09 8:40,2011-12-09 8:48,,2011-12-09 10:54,2011-12-09 10:58,
18914,2011-12-09 6:59,2011-12-09 6:55,,2011-12-09 10:34,2011-12-09 10:22,
18941,,8:45 AMDec 09,,,10:17 AMDec 09,
18967,,6:08 AMDec 09,,,10:01 AMDec 09,
18968,,6:08 AMDec 09,,,9:56 AMDec 09,
18971,2011-12-09 6:00,,,2011-12-09 10:20,,
19002,,12/9/11 7:23 AM (-06:00),,,12/9/11 10:27 AM (-05:00),
19046,Dec 09 - 10:40am,Dec 09 - 12:11pm,C28/C,Dec 09 - 2:59pm,Dec 09 - 4:12pm,Aug-45
19060,2011-12-09 07:10AM EST,2011-12-09 07:27AM EST,D3,2011-12-09 09:22AM CST,2011-12-09 09:12AM CST,K15
19073,Dec 09 - 7:10am,Dec 09 - 7:11am,D3,Dec 09 - 9:35am,Dec 09 - 9:20am,K15/T3
19085,,2011-12-09 13:57,70B,,2011-12-09 19:58,C19
19105,,12/9/11 12:14 PM (-06:00),,,12/9/11 2:01 PM (-05:00),
19141,2:30 PM_ Dec 09,3:36 PM_ Dec 09,,6:15 PM_ Dec 09,6:38 PM_ Dec 09,
19144,2:30 PM_ Dec 09,3:36 PM_ Dec 09,,6:15 PM_ Dec 09,6:31 PM_ Dec 09,
19158,11:50 AM  Fri 09-Dec-2011,11:56 AM  Fri 09-Dec-2011,D21,03:50 PM  Fri 09-Dec-2011,03:43 PM  Fri 09-Dec-2011,9
19181,2011-12-09 04:00PM EST,2011-12-09 04:26PM EST,131,2011-12-09 06:55PM EST,2011-12-09 07:10PM EST,G19
19224,2011-12-09 16:00,,,2011-12-09 18:40,,
19253,,12/9/2011 12:10AM PST,,,12/9/2011 6:01AM CST,
19257,,12/9/11 12:10 AM (-08:00),,,12/9/11 6:01 AM (-06:00),
19286,,12/9/11 7:16 AM (-06:00),,,12/9/11 9:09 AM (-06:00),
19301,Dec 09 - 7:10am,Dec 09 - 7:08am,A25,Dec 09 - 9:40am,Dec 09 - 9:12am,G8/T3
19313,2011-12-09 06:45AM EST,2011-12-09 07:25AM EST,E5,2011-12-09 07:36AM EST,2011-12-09 08:01AM EST,14
19358,2011-12-09 9:15,2011-12-09 9:15,,2011-12-09 12:18,2011-12-09 12:16,
19373,,1:45 PMDec 09,,,9:59 AMDec 09,
19412,,8:32 AMDec 09,,,10:04 AMDec 09,
19502,12:00 PM_ Dec 09,12:08 PM_ Dec 09,Terminal 8 - 40,3:15 PM_ Dec 09,2:53 PM_ Dec 09,Terminal 4 - 47B
19521,2011-12-09 8:35,2011-12-09 8:28,,2011-12-09 11:50,2011-12-09 11:22,
19522,2011-12-09 8:35,2011-12-09 8:28,,2011-12-09 11:50,2011-12-09 11:22,
19532,2011-12-09 8:35,2011-12-09 8:41,,2011-12-09 11:50,2011-12-09 11:13,
19540,12/9/11 7:00 PM (-06:00),,,12/9/11 10:15 PM (-05:00),,
19565,03:05 PM  Fri 09-Dec-2011,03:13 PM  Fri 09-Dec-2011,B2,06:30 PM  Fri 09-Dec-2011,06:25 PM  Fri 09-Dec-2011,58B
19592,06:45 PM  Fri 09-Dec-2011,06:42 PM  Fri 09-Dec-2011,G1A,09:10 PM  Fri 09-Dec-2011,08:58 PM  Fri 09-Dec-2011,D28
19593,06:45 PM  Fri 09-Dec-2011,06:42 PM  Fri 09-Dec-2011,G1A,09:10 PM  Fri 09-Dec-2011,08:58 PM  Fri 09-Dec-2011,D28
19608,Dec 09 - 6:45pm,Dec 09 - 6:42pm,G1A/T3,Dec 09 - 9:10pm,Dec 09 - 8:58pm,D28
19639,,12/9/11 11:29 PM (-08:00),,,12/10/11 6:37 AM (-05:00),
19691,,12/9/11 1:55 PM (-06:00),,,12/9/11 3:46 PM (-07:00),
19786,2011-12-09 11:15,2011-12-09 11:12,,2011-12-09 13:40,2011-12-09 13:43,
19789,December 9_ 2011               07:45 PM,December 9_ 2011               07:40 PM,K12,December 9_ 2011               10:30 PM,December 9_ 2011,6
19885,,9:55 AMDec 09,,,1:07 PMDec 09,
19908,,4:38 PMDec 09,,,7:45 PMDec 09,
19915,2011-12-09 16:16,,B36,,,
19937,11:08 PMDec 09,,,5:11 AMDec 10,,
19953,2011-12-09 01:29PM EST,2011-12-09 01:59PM EST,136,2011-12-09 04:14PM EST,2011-12-09 04:24PM EST,39
19969,,12/9/2011 10:56AM EST,,,12/9/2011 2:10PM EST,
19978,,10:56 AMDec 09,,,2:16 PMDec 09,
20043,,2011-12-10 8:39,A2,,2011-12-10 9:38,
20085,,12/10/11 1:19 PM (-05:00),,,12/10/11 3:25 PM (-08:00),
20142,2011-12-10 20:20,,,2011-12-10 21:20,,
20165,7:10 AM_ Dec 10,7:34 AM_ Dec 10,,3:30 PM_ Dec 10,3:26 PM_ Dec 10,
20180,2011-12-10 7:00,2011-12-10 7:01,,2011-12-10 9:55,2011-12-10 9:55,
20184,7:00 AM_ Dec 10,7:27 AM_ Dec 10,Terminal 2,9:55 AM_ Dec 10,9:55 AM_ Dec 10,Terminal D - D60
20207,2011-12-10 6:00,2011-12-10 6:02,,2011-12-10 7:30,2011-12-10 7:13,
20218,2011-12-10 6:00,,E14,2011-12-10 7:30,,H4
20228,06:30 AM  Sat 10-Dec-2011,06:43 AM  Sat 10-Dec-2011,D1,09:15 AM  Sat 10-Dec-2011,09:03 AM  Sat 10-Dec-2011,C38
20229,06:30 AM  Sat 10-Dec-2011,06:43 AM  Sat 10-Dec-2011,D1,09:15 AM  Sat 10-Dec-2011,09:03 AM  Sat 10-Dec-2011,C38
20238,6:30 AM_ Dec 10,6:58 AM_ Dec 10,Terminal D - D1,9:15 AM_ Dec 10,9:03 AM_ Dec 10,Terminal 8 - 38
20276,2011-12-10 8:55,2011-12-10 9:02,,2011-12-10 11:45,2011-12-10 11:47,
20309,Dec 10 - 6:30pm,Dec 10 - Not Available,D33,Dec 10 - 7:25pm,Dec 10 - Not Available,14
20334,12/10/11 11:05 AM (-07:00),,,12/10/11 4:57 PM (-05:00),,
20411,2011-12-10 11:40AM CST,2011-12-10 01:52PM CST,40,2011-12-10 12:50PM MST,2011-12-10 02:54PM MST,B16
20421,,1:52 PMDec 10,,,2:59 PMDec 10,
20427,,1:52 PMDec 10,,,2:59 PMDec 10,
20483,,2011-12-10 0:36,64,,2011-12-10 5:21,39
20498,,12/10/2011 1:21PM CST,,,12/10/2011 2:27PM MST,
20502,,12/10/11 1:21 PM (-06:00),,,12/10/11 2:27 PM (-07:00),
20536,2011-12-10 6:00,2011-12-10 6:06,,2011-12-10 9:20,2011-12-10 9:19,
20549,Dec 10 - 6:00am,Dec 10 - 6:06am,A27,Dec 10 - 9:20am,Dec 10 - 9:19am,D30
20580,03:27 PM  Sat 10-Dec-2011,03:51 PM  Sat 10-Dec-2011,58,05:05 PM  Sat 10-Dec-2011,05:25 PM  Sat 10-Dec-2011,D3
20620,2011-12-10 13:05,,H14,2011-12-10 14:35,,A47
20632,,2:51 PMDec 10,,,6:49 PMDec 10,
20636,,2:51 PMDec 10,,,6:49 PMDec 10,
20637,,2:51 PMDec 10,,,6:34 PMDec 10,
20653,2011-12-10 10:40,2011-12-10 10:47,,2011-12-10 14:45,2011-12-10 14:44,
20658,10:40 AM_ Dec 10,11:04 AM_ Dec 10,,2:45 PM_ Dec 10,2:44 PM_ Dec 10,
20668,2011-12-10 10:40AM CST,2011-12-10 11:04AM CST,K15,2011-12-10 02:36PM EST,2011-12-10 02:36PM EST,D1
20709,7:10 AM_ Dec 10,7:25 AM_ Dec 10,Terminal 8 - 42,10:45 AM_ Dec 10,10:08 AM_ Dec 10,Terminal 2 - 58B
20730,,3:22 PMDec 10,,,4:40 PMDec 10,
20744,12/10/11 9:00 PM (-08:00),,,12/11/11 12:15 AM (-07:00),,
20772,2011-12-10 07:55AM CST,2011-12-10 08:12AM CST,B25,2011-12-10 11:02AM EST,2011-12-10 11:03AM EST,3
20775,07:55 AM  Sat 10-Dec-2011,07:51 AM  Sat 10-Dec-2011,B25,11:05 AM  Sat 10-Dec-2011,11:08 AM  Sat 10-Dec-2011,3
20791,December 10_ 2011               02:35 PM,December 10_ 2011               02:27 PM,A7,December 10_ 2011               04:05 PM,December 10_ 2011               03:30 PM,G4
20814,2011-12-10 14:35,,7,2011-12-10 16:05,,G4
20842,,12/10/11 10:52 AM (-06:00),,,12/10/11 12:35 PM (-05:00),
20896,,12/10/11 7:18 AM (-07:00),,,12/10/11 11:15 AM (-06:00),
20911,7:15 AM_ Dec 10,7:19 AM_ Dec 10,Terminal 3,11:35 AM_ Dec 10,11:17 AM_ Dec 10,H11A
20919,12/10/11 2:53 PM (-05:00),,,12/10/11 4:48 PM (-06:00),,
20964,2011-12-10 Sat  20:00,,15?,,,
20968,December 10_ 2011               11:35 AM,December 10_ 2011               11:36 AM,D24,December 10_ 2011               02:25 PM,December 10_ 2011               02:28 PM,48B
20971,,12/10/11 11:55 AM (-05:00),,,12/10/11 2:19 PM (-08:00),
21006,,8:38 AMDec 10,,,9:16 AMDec 10,
21035,7:25 AM_ Dec 10,8:03 AM_ Dec 10,A34,11:10 AM_ Dec 10,11:23 AM_ Dec 10,Terminal D - D25
21080,,10:48 AMDec 10,,,6:52 PMDec 10,
21120,12/10/11 8:05 AM (-07:00),,,12/10/11 11:35 AM (-06:00),,
21122,,2011-12-10 8:02,6A,,2011-12-10 11:21,31
21132,,8:14 AMDec 10,,,11:17 AMDec 10,
21178,6:00 AM_ Dec 10,6:02 AM_ Dec 10,Terminal 3 - 2,6:40 AM_ Dec 10,6:23 AM_ Dec 10,Terminal 4 - 44J
21200,2011-12-10 20:25,2011-12-10 8:25 PM (Estimated),,2011-12-10 23:50,2011-12-10 11:50 PM (Estimated),
21208,8:25pDec 10,,C21,11:50pDec 10,,D32
21249,2011-12-10 6:59,2011-12-10 6:55,,2011-12-10 10:34,2011-12-10 11:01,
21251,2011-12-10 6:59,2011-12-10 6:55,,2011-12-10 10:34,2011-12-10 11:01,
21294,12/10/11 6:00 AM (-06:00),,,12/10/11 10:20 AM (-05:00),,
21331,2011-12-10 15:35,,5,2011-12-10 16:00,,G18
21344,07:15 AM  Sat 10-Dec-2011,07:09 AM  Sat 10-Dec-2011,A37,10:35 AM  Sat 10-Dec-2011,10:43 AM  Sat 10-Dec-2011,17
21357,,,,2011-12-10 Sat  10:35,2011-12-10 Sat  10:36,17?
21369,2011-12-10 10:40AM CST,2011-12-10 12:07PM CST,C16,2011-12-10 02:50PM EST,2011-12-10 03:57PM EST,33
21400,2011-12-10 7:10,2011-12-10 7:10,,2011-12-10 9:35,2011-12-10 9:18,
21403,7:10 AM_ Dec 10,7:27 AM_ Dec 10,Terminal D - D40,9:35 AM_ Dec 10,9:14 AM_ Dec 10,H15
21412,2011-12-10 7:10,,D40,2011-12-10 9:35,,H15
21467,,12/10/11 12:08 PM (-06:00),,,12/10/11 3:43 PM (-05:00),
21468,,12/10/11 12:08 PM (-06:00),,,12/10/11 3:43 PM (-05:00),
21481,11:50 AM_ Dec 10,12:08 PM_ Dec 10,D18,3:50 PM_ Dec 10,4:00 PM_ Dec 10,A9
21486,2011-12-10 11:50,,,2011-12-10 15:50,,
21504,4:00 PM_ Dec 10,4:06 PM_ Dec 10,A29,6:40 PM_ Dec 10,6:20 PM_ Dec 10,Terminal 3
21510,Dec 10 - 4:00pm,Dec 10 - 3:48pm,A29,Dec 10 - 6:40pm,Dec 10 - 6:23pm,H4/T3
21521,,12/10/11 12:02 AM (-08:00),,,12/10/11 5:44 AM (-06:00),
21551,2011-12-10 07:10AM CST,2011-12-10 07:15AM CST,A29,2011-12-10 09:26AM CST,2011-12-10 09:12AM CST,H5
21614,3:45 PM_ Dec 10,3:55 PM_ Dec 10,Term C - C112,6:31 PM_ Dec 10,6:35 PM_ Dec 10,Term B - 35
21677,,5:47 PMDec 10,,,7:58 PMDec 10,
21766,2011-12-10 19:00,2011-12-10 19:00,,2011-12-10 22:15,2011-12-10 22:04,
21787,2011-12-10 15:05,2011-12-10 15:01,,2011-12-10 18:30,2011-12-10 17:55,
21789,2011-12-10 15:05,2011-12-10 15:01,,2011-12-10 18:30,2011-12-10 17:55,
21820,8:05 PM_ Dec 10,8:37 PM_ Dec 10,Terminal 3,10:20 PM_ Dec 10,10:27 PM_ Dec 10,Terminal N
21823,8:05pDec 10,8:23pDec 10,G19A,10:20pDec 10,10:33pDec 10,D19
21830,12/10/11 7:30 AM (-05:00),,,12/10/11 8:00 AM (-06:00),,
21851,2011-12-10 7:30,,5,2011-12-10 8:00,,G4
21870,11:25 PM_ Dec 10,,,6:55 AM_ Dec 11,,
21881,2011-12-10 23:25,2011-12-10 23:38,,2011-12-10 6:55,2011-12-10 6:38,
21928,2011-12-10 12:15,,G5,2011-12-10 14:45,,A3
21943,09:05 AM  Sat 10-Dec-2011,08:59 AM  Sat 10-Dec-2011,C24,12:35 PM  Sat 10-Dec-2011,12:38 PM  Sat 10-Dec-2011,D32
21944,2011-12-10 9:05,2011-12-10 8:59,,2011-12-10 12:35,2011-12-10 12:38,
21962,,12/10/11 3:15 PM (-05:00),,,12/10/11 5:51 PM (-05:00),
21990,,2011-12-10 11:12,D14,,2011-12-10 13:32,A17
22007,December 10_ 2011               07:45 PM,December 10_ 2011               07:43 PM,K8,December 10_ 2011               10:30 PM,December 10_ 2011,6
22041,07:45 PM  Sat 10-Dec-2011,,K8,10:30 PM  Sat 10-Dec-2011,,6
22090,7:45 PM_ Dec 10,7:57 PM_ Dec 10,,10:30 PM_ Dec 10,10:13 PM_ Dec 10&nbsp(Estimated),
22104,2011-12-10 09:45AM EST,2011-12-10 09:56AM EST,A7,2011-12-10 01:03PM CST,2011-12-10 12:53PM CST,E21
22138,Dec 10 - Not Available,Dec 10 - 4:35pm,B26,Dec 10 - Not Available,Dec 10 - 7:38pm,C26
22161,11:20 PM_ Dec 10,,,5:17 AM_ Dec 11,,
22196,,12/10/11 11:03 AM (-05:00),,,12/10/11 2:14 PM (-05:00),
22210,2011-12-10 10:45,,,2011-12-10 14:20,,
22226,2011-12-10 7:35,2011-12-10 7:36,,2011-12-10 9:21,2011-12-10 9:23,
22239,,12/11/11 3:17 PM (-05:00),,,12/11/11 4:40 PM (-05:00),
22270,,8:55 AMDec 11,,,9:31 AMDec 11,
22272,,8:55 AMDec 11,,,9:31 AMDec 11,
22273,,8:55 AMDec 11,,,9:31 AMDec 11,
22280,8:42aDec 11,,-,9:55aDec 11,,-
22308,Sun_ Dec 11 12:30 PM,Sun_ Dec 11 12:53 PM            Delayed,D7,Sun_ Dec 11 3:19 PM,Sun_ Dec 11 3:33 PM,75B
22346,,2011-12-11 12:53,D7,,2011-12-11 15:33,75B
22383,,1:15 PMDec 11,,,3:24 PMDec 11,
22445,2011-12-11 7:00,2011-12-11 7:21,,2011-12-11 9:55,2011-12-11 10:15,
22446,2011-12-11 7:00,2011-12-11 7:21,,2011-12-11 9:55,2011-12-11 10:15,
22473,6:00 AM_ Dec 11,6:27 AM_ Dec 11,E14,7:30 AM_ Dec 11,7:22 AM_ Dec 11,G11
22499,6:30 AM_ Dec 11,7:01 AM_ Dec 11,Terminal D - D11,9:15 AM_ Dec 11,9:23 AM_ Dec 11,Terminal 8 - 42
22500,6:30 AM_ Dec 11,7:01 AM_ Dec 11,,9:15 AM_ Dec 11,9:23 AM_ Dec 11,
22508,2011-12-11 06:30AM EST,2011-12-11 07:01AM EST,D11,2011-12-11 09:03AM EST,2011-12-11 09:12AM EST,42
22540,,2011-12-11 9:19,17,,2011-12-11 11:52,15
22549,,9:31 AMDec 11,,,11:42 AMDec 11,
22566,6:30 PM_ Dec 11,,,7:25 PM_ Dec 11,,
22582,,2011-12-11 8:58,,,2011-12-11 11:51,60
22604,11:05 AM  Sun 11-Dec-2011,11:00 AM  Sun 11-Dec-2011,A3,04:57 PM  Sun 11-Dec-2011,04:55 PM  Sun 11-Dec-2011,B7
22622,,12/11/11 12:16 PM (-07:00),,,12/11/11 6:10 PM (-05:00),
22633,11:55 AM_ Dec 11,12:17 PM_ Dec 11,,6:17 PM_ Dec 11,6:17 PM_ Dec 11,
22650,,11:37 AMDec 11,,,5:04 PMDec 11,
22686,,12/11/11 12:25 PM (-05:00),,,12/11/11 1:44 PM (-05:00),
22770,,12/11/11 6:02 AM (-06:00),,,12/11/11 8:55 AM (-05:00),
22789,6:00aDec 11,5:54aDec 11,A27,9:20aDec 11,8:56aDec 11,D12
22793,,12/11/11 3:55 PM (-05:00),,,12/11/11 6:08 PM (-05:00),
22816,2011-12-11 03:50PM EST,2011-12-11 03:56PM EST,,2011-12-11 06:26PM EST,2011-12-11 06:02PM EST,
22934,,12/11/11 12:49 PM (-07:00),,,12/11/11 4:36 PM (-06:00),
22990,,12:49 PMDec 11,,,4:38 PMDec 11,
23015,10:40 AM  Sun 11-Dec-2011,10:42 AM  Sun 11-Dec-2011,K9,02:45 PM  Sun 11-Dec-2011,02:36 PM  Sun 11-Dec-2011,D24
23049,2:30pDec 11,3:05pDec 11,C-44,7:03pDec 11,7:27pDec 11,C75
23057,,12/11/11 7:36 AM (-05:00),,,12/11/11 10:14 AM (-08:00),
23070,7:10 AM_ Dec 11,7:37 AM_ Dec 11,,10:45 AM_ Dec 11,10:25 AM_ Dec 11,
23086,,2011-12-11 15:08,C8,,2011-12-11 17:11,109
23087,,2011-12-11 15:08,C8,,2011-12-11 17:11,109
23098,3:10pDec 11,3:08pDec 11,C08,5:04pDec 11,5:11pDec 11,109
23148,7:55 AM_ Dec 11,8:08 AM_ Dec 11,B18,11:05 AM_ Dec 11,10:58 AM_ Dec 11,Terminal 2
23168,02:35 PM  Sun 11-Dec-2011,02:28 PM  Sun 11-Dec-2011,7,04:05 PM  Sun 11-Dec-2011,03:24 PM  Sun 11-Dec-2011,G8
23181,2011-12-11 14:35,,7,2011-12-11 16:05,,G8
23182,2011-12-11 14:35,,A7,,,
23222,,8:06 AMDec 11,,,9:55 AMDec 11,
23224,,8:06 AMDec 11,,,9:55 AMDec 11,
23231,December 11_ 2011               10:40 AM,December 11_ 2011               10:36 AM,G8,December 11_ 2011               12:55 PM,December 11_ 2011               12:43 PM,A1
23235,,12/11/11 10:49 AM (-06:00),,,12/11/11 12:40 PM (-05:00),
23288,2011-12-11 07:15AM MST,2011-12-11 07:21AM MST,6,2011-12-11 11:23AM CST,2011-12-11 11:13AM CST,H15
23316,2011-12-11 14:53,2011-12-11 15:01,,2011-12-11 16:48,2011-12-11 17:09,
23351,8:00pDec 11,8:00pDec 11,15,9:50pDec 11,9:38pDec 11,K3
23354,2011-12-11 Sun  20:00,,15?,,,
23398,,6:13 AMDec 11,,,7:20 AMDec 11,
23401,Dec 11 - Not Available,Dec 11 - 6:12am,73,Dec 11 - Not Available,Dec 11 - 7:20am,88
23424,,7:50 PMDec 11,,,9:04 PMDec 11,
23428,,12/11/11 9:50 AM (-05:00),,,12/11/11 10:22 AM (-05:00),
23460,7:25 AM_ Dec 11,7:56 AM_ Dec 11,D30,11:10 AM_ Dec 11,11:17 AM_ Dec 11,Terminal D - D2
23520,,12/11/11 4:26 PM (-06:00),,,12/11/11 7:38 PM (-05:00),
23521,,12/11/11 4:26 PM (-06:00),,,12/11/11 7:38 PM (-05:00),
23557,2011-12-11 19:15,2011-12-11 7:15 PM (Estimated),,2011-12-11 0:21,2011-12-11 12:21 AM (Estimated),
23568,Dec 11 - 7:15pm,Dec 11 - Not Available,60,Dec 12 - 12:21am,Dec 12 - Not Available,Not provided by airline
23575,12/11/11 8:05 AM (-07:00),,,12/11/11 11:35 AM (-06:00),,
23597,2011-12-11 04:00PM EST,2011-12-11 04:09PM EST,,2011-12-11 06:02PM EST,2011-12-11 06:20PM EST,
23601,04:00 PM  Sun 11-Dec-2011,03:54 PM  Sun 11-Dec-2011,E3,06:46 PM  Sun 11-Dec-2011,06:28 PM  Sun 11-Dec-2011,B5
23687,2011-12-11 8:40,,,2011-12-11 10:54,,
23698,06:59 AM  Sun 11-Dec-2011,06:55 AM  Sun 11-Dec-2011,B3,10:34 AM  Sun 11-Dec-2011,10:14 AM  Sun 11-Dec-2011,D24
23712,2011-12-11 6:59,2011-12-11 7:14,,2011-12-11 10:34,2011-12-11 10:08,
23730,,8:49 AMDec 11,,,10:04 AMDec 11,
23731,,8:49 AMDec 11,,,10:04 AMDec 11,
23752,,6:28 AMDec 11,,,10:27 AMDec 11,
23755,6:00aDec 11,6:03aDec 11,E12,10:20aDec 11,10:27aDec 11,112
23859,2011-12-11 7:10,,D2,2011-12-11 9:35,,K9
23872,,2:09 PMDec 11,,,7:32 PMDec 11,
23874,,2:09 PMDec 11,,,7:32 PMDec 11,
23909,,12/11/2011 2:52PM EST,,,12/11/2011 5:31PM PST,
23911,,12/11/11 2:54 PM (-05:00),,,12/11/11 5:25 PM (-08:00),
23921,2011-12-11 14:30,2011-12-11 14:27,,2011-12-11 18:10,2011-12-11 17:38,
23926,2:30 PM_ Dec 11,2:54 PM_ Dec 11,7,6:10 PM_ Dec 11,5:38 PM_ Dec 11,Terminal 3 - 81
23982,,12/11/11 4:10 PM (-06:00),,,12/11/11 6:13 PM (-06:00),
23994,4:00 PM_ Dec 11,4:10 PM_ Dec 11,A29,6:40 PM_ Dec 11,6:12 PM_ Dec 11,Terminal 3
23999,Dec 11 - 4:00pm,Dec 11 - 3:52pm,A29,Dec 11 - 6:40pm,Dec 11 - 6:17pm,G13/T3
24002,2011-12-11 16:00,,29,2011-12-11 18:40,,G13
24063,,12/11/11 7:12 AM (-06:00),,,12/11/11 9:18 AM (-06:00),
24112,Sun._ Dec.11_ 2011 9:00 a.m.,Sun._ Dec.11_ 2011 8:54 a.m.,,Sun._ Dec.11_ 2011 12:00 p.m.,Sun._ Dec.11_ 2011 11:42 a.m.,
24121,09:00 AM  Sun 11-Dec-2011,08:54 AM  Sun 11-Dec-2011,80,12:00 PM  Sun 11-Dec-2011,11:42 AM  Sun 11-Dec-2011,39
24226,,2011-12-11 18:18,102,,2011-12-11 21:02,39
24228,,2011-12-11 18:18,102,,2011-12-11 21:02,39
24251,,11:38 AMDec 11,,,2:33 PMDec 11,
24259,2011-12-11 11:25,,B22,,,
24302,8:35 AM_ Dec 11,8:36 AM_ Dec 11,,11:50 AM_ Dec 11,11:30 AM_ Dec 11,
24322,,2011-12-11 19:07,17,,2011-12-11 22:21,35
24401,2011-12-11 7:30,2011-12-11 7:15,,2011-12-11 8:00,2011-12-11 7:45,
24404,7:30 AM_ Dec 11,7:53 AM_ Dec 11,Terminal 2,8:00 AM_ Dec 11,7:41 AM_ Dec 11,G19A
24419,12/11/2011 11:25PM PST,,,12/12/2011 6:55AM EST,,
24448,,12/11/11 12:16 PM (-05:00),,,12/11/11 1:41 PM (-05:00),
24491,Dec 11 - 12:15pm,Dec 11 - 12:24pm,G5/T3,Dec 11 - 2:45pm,Dec 11 - 2:30pm,A3
24493,2011-12-11 12:15,,,2011-12-11 14:45,,
24495,12:15pDec 11,12:24pDec 11,G5,2:45pDec 11,2:30pDec 11,A3
24505,2011-12-11 09:05AM CST,2011-12-11 09:12AM CST,C19,2011-12-11 12:29PM EST,2011-12-11 12:23PM EST,D32
24524,,12/11/11 3:21 PM (-05:00),,,12/11/11 5:47 PM (-05:00),
24579,,12/11/11 7:55 PM (-06:00),,,12/11/11 10:07 PM (-07:00),
24610,2011-12-11 19:45,2011-12-11 19:42,,2011-12-11 22:30,2011-12-11 10:28 PM (Estimated),
24673,,12/11/11 4:27 PM (-07:00),,,12/11/11 7:19 PM (-06:00),
24674,,12/11/11 4:27 PM (-07:00),,,12/11/11 7:19 PM (-06:00),
24685,,4:30 PMDec 11,,,7:30 PMDec 11,
24709,2011-12-11 23:55,2011-12-11 12:03 AM (Estimated runway),,2011-12-11 5:55,2011-12-11 5:40 AM (Estimated runway),
24729,,2011-12-11 13:52,73,,2011-12-11 16:34,39
24745,,12/11/11 10:59 AM (-05:00),,,12/11/11 2:00 PM (-05:00),
24838,1:30 PM_ Dec 12,,H14,3:50 PM_ Dec 12,,Terminal A - 7
24847,Mon_ Dec 12 12:30 PM,Mon_ Dec 12 12:27 PM            On Time,C11,Mon_ Dec 12 3:19 PM,Mon_ Dec 12 3:03 PM,75B
24859,,12/12/11 12:42 PM (-05:00),,,12/12/11 3:11 PM (-08:00),
24870,,12/12/11 12:42 PM (-05:00),,,12/12/11 3:07 PM (-08:00),
24879,,2011-12-12 12:27,C11,,2011-12-12 15:25,75B
24910,,12:42 PMDec 12,,,2:54 PMDec 12,
24912,,12:42 PMDec 12,,,3:25 PMDec 12,
24921,12:30pDec 12,12:27pDec 12,C11,2:47pDec 12,,75B
24955,,12/12/2011 7:26AM PST,,,12/12/2011 3:05PM EST,
24956,,12/12/11 7:24 AM (-08:00),,,12/12/11 3:05 PM (-05:00),
24973,7:10 AM_ Dec 12,7:26 AM_ Dec 12,,3:30 PM_ Dec 12,3:03 PM_ Dec 12,
24979,December 12_ 2011               07:00 AM,December 12_ 2011               06:53 AM,3,December 12_ 2011               09:55 AM,December 12_ 2011               09:51 AM,D53
24996,7:00 AM_ Dec 12,7:35 AM_ Dec 12,Terminal 2,9:55 AM_ Dec 12,9:51 AM_ Dec 12,Terminal D - D53
25001,2011-12-12 7:00,,,2011-12-12 9:55,,
25025,2011-12-12 6:00,,E14,2011-12-12 7:30,,G13
25042,6:30 AM_ Dec 12,7:02 AM_ Dec 12,Terminal D - D25,9:15 AM_ Dec 12,9:30 AM_ Dec 12,Terminal 8 - 5
25065,,5:45 PMDec 12,,,8:29 PMDec 12,
25069,,5:45 PMDec 12,,,8:29 PMDec 12,
25103,6:30 PM_ Dec 12,,,7:25 PM_ Dec 12,,
25111,2011-12-12 18:30,2011-12-12 19:38,,2011-12-12 19:25,2011-12-12 20:21,
25147,2011-12-12 11:05,2011-12-12 11:02,,2011-12-12 16:57,2011-12-12 16:47,
25148,2011-12-12 11:05,2011-12-12 11:02,,2011-12-12 16:57,2011-12-12 16:47,
25158,2011-12-12 11:05,2011-12-12 11:02,,2011-12-12 16:57,2011-12-12 16:47,
25182,11:55aDec 12,11:50aDec 12,-,6:17pDec 12,6:12pDec 12,-
25200,2011-12-12 11:25,,27,2011-12-12 17:25,,H6
25224,2011-12-12 11:40AM CST,2011-12-12 11:48AM CST,40,2011-12-12 12:42PM MST,2011-12-12 12:51PM MST,B18
25228,,12/12/11 12:17 PM (-05:00),,,12/12/11 1:33 PM (-05:00),
25251,12/12/11 10:39 AM (-08:00),,,12/12/11 11:19 AM (-08:00),,
25265,10:39 AM_ Dec 12,11:04 AM_ Dec 12,,11:19 AM_ Dec 12,11:29 AM_ Dec 12,
25288,12:30aDec 12,12:46aDec 12,62,5:35aDec 12,5:42aDec 12,E12
25292,,12/12/2011 1:16PM CST,,,12/12/2011 2:28PM MST,
25404,,7:25 AMDec 12,,,10:25 AMDec 12,
25463,,12/12/11 5:38 PM (-06:00),,,12/12/11 6:18 PM (-06:00),
25490,Mon_ Dec 12 12:57 PM,Mon_ Dec 12 12:57 PM            On Time,3,Mon_ Dec 12 5:15 PM,Mon_ Dec 12 4:45 PM,B17
25493,,12/12/11 1:04 PM (-07:00),,,12/12/11 4:41 PM (-06:00),
25550,8:58aDec 12,1:05pDec 12,3,5:15pDec 12,4:45pDec 12,B17
25614,2011-12-12 7:10,2011-12-12 7:27,,2011-12-12 10:45,2011-12-12 10:43,
25618,7:10 AM_ Dec 12,7:53 AM_ Dec 12,,10:45 AM_ Dec 12,10:43 AM_ Dec 12,
25647,12/12/11 9:00 PM (-08:00),,,12/13/11 12:15 AM (-07:00),,
25668,,,,2011-12-12 0:15,,A53
25770,,12/12/11 10:50 AM (-06:00),,,12/12/11 12:36 PM (-05:00),
25786,10:40aDec 12,10:34aDec 12,G6B,12:55pDec 12,12:46pDec 12,A1
25810,8:00 AM_ Dec 12,8:17 AM_ Dec 12,,11:55 AM_ Dec 12,11:00 AM_ Dec 12,
25826,07:15 AM  Mon 12-Dec-2011,07:11 AM  Mon 12-Dec-2011,6,11:35 AM  Mon 12-Dec-2011,10:59 AM  Mon 12-Dec-2011,H11A
25841,Mon._ Dec.12_ 2011 2:53 p.m.,Mon._ Dec.12_ 2011 2:59 p.m.,,Mon._ Dec.12_ 2011 4:48 p.m.,Mon._ Dec.12_ 2011 4:48 p.m.,
25889,December 12_ 2011               11:35 AM,December 12_ 2011               11:34 AM,D17,December 12_ 2011               02:25 PM,December 12_ 2011               02:28 PM,46A
25890,,12/12/2011 11:49AM EST,,,12/12/2011 2:12PM PST,
25910,2011-12-12 11:35,2011-12-12 11:49,,2011-12-12 14:25,2011-12-12 14:12,
25921,,2011-12-12 5:59,72,,2011-12-12 7:12,90
25943,2011-12-12 07:10PM CST,2011-12-12 07:51PM CST,41,2011-12-12 08:30PM PST,2011-12-12 09:17PM PST,62
25944,,2011-12-12 19:32,41,,2011-12-12 20:56,62
25954,,7:52 PMDec 12,,,9:17 PMDec 12,
25960,,12/12/11 9:33 AM (-05:00),,,12/12/11 10:09 AM (-05:00),
26022,10:15 AM_ Dec 12,10:40 AM_ Dec 12,,12:10 PM_ Dec 12,12:17 PM_ Dec 12,
26068,4:15 PM_ Dec 12,4:29 PM_ Dec 12,,7:55 PM_ Dec 12,7:43 PM_ Dec 12,
26078,2011-12-12 8:05,2011-12-12 8:05,,2011-12-12 11:35,2011-12-12 11:43,
26085,,8:24 AMDec 12,,,11:34 AMDec 12,
26096,2011-12-12 04:00PM EST,2011-12-12 04:06PM EST,,2011-12-12 06:21PM EST,2011-12-12 06:14PM EST,
26097,04:00 PM  Mon 12-Dec-2011,03:53 PM  Mon 12-Dec-2011,E3,06:46 PM  Mon 12-Dec-2011,06:18 PM  Mon 12-Dec-2011,C30
26105,4:00 PM_ Dec 12,4:06 PM_ Dec 12,,6:46 PM_ Dec 12,6:46 PM_ Dec 12,
26112,2011-12-12 04:00PM EST,2011-12-12 04:06PM EST,,2011-12-12 06:21PM EST,2011-12-12 06:14PM EST,
26127,2011-12-12 6:00,2011-12-12 5:58,,2011-12-12 6:40,2011-12-12 6:20,
26171,,2011-12-12 8:36,C9,,2011-12-12 10:45,45
26214,,12/12/11 8:48 AM (-05:00),,,12/12/11 9:59 AM (-06:00),
26239,,2011-12-12 6:05,9,,2011-12-12 10:22,75
26244,,6:15 AMDec 12,,,10:22 AMDec 12,
26253,December 12_ 2011               03:35 PM,December 12_ 2011               03:28 PM,5,December 12_ 2011               04:00 PM,December 12_ 2011               03:37 PM,G19
26266,2011-12-12 15:35,2011-12-12 15:28,,2011-12-12 16:00,2011-12-12 15:37,
26269,,3:44 PMDec 12,,,3:33 PMDec 12,
26272,,3:44 PMDec 12,,,3:33 PMDec 12,
26283,2011-12-12 07:15AM CST,2011-12-12 07:27AM CST,D18,2011-12-12 10:26AM EST,2011-12-12 10:33AM EST,17
26304,,12/12/11 10:57 AM (-06:00),,,12/12/11 2:40 PM (-05:00),
26335,07:10 AM  Mon 12-Dec-2011,07:06 AM  Mon 12-Dec-2011,D1,09:35 AM  Mon 12-Dec-2011,09:17 AM  Mon 12-Dec-2011,H15
26354,,12/12/11 2:07 PM (-08:00),,,12/12/11 7:26 PM (-06:00),
26366,,2:38 PMDec 12,,,7:45 PMDec 12,
26368,2011-12-12 13:55,,,2011-12-12 19:53,,
26394,Mon_ Dec 12 2:30 PM,Mon_ Dec 12 2:25 PM,9,Mon_ Dec 12 6:15 PM,Mon_ Dec 12 5:38 PM,82
26416,2:30 PM_ Dec 12,2:42 PM_ Dec 12,,6:15 PM_ Dec 12,5:30 PM_ Dec 12,
26466,,12/12/2011 4:14PM CST,,,12/12/2011 6:11PM CST,
26530,11:55 PM_ Dec 12,,Terminal 2 - 57,5:50 AM_ Dec 13,,Terminal 3 - H9
26558,7:10 AM_ Dec 12,7:12 AM_ Dec 12,,9:40 AM_ Dec 12,9:12 AM_ Dec 12,
26567,December 12_ 2011               06:45 AM,December 12_ 2011               06:52 AM,E5,December 12_ 2011               07:45 AM,December 12_ 2011               07:49 AM,15
26637,,12/12/11 3:25 PM (-05:00),,,12/12/11 5:01 PM (-05:00),
26640,,2011-12-12 15:03,D23,,2011-12-12 17:03,C26
26706,,6:38 PMDec 12,,,8:58 PMDec 12,
26718,12/12/11 11:25 AM (-07:00),,,12/12/11 2:50 PM (-06:00),,
26719,,2011-12-12 11:27,B22,,2011-12-12 14:44,44
26722,2011-12-12 11:25,2011-12-12 11:27,,2011-12-12 14:50,2011-12-12 14:44,
26725,,11:42 AMDec 12,,,2:44 PMDec 12,
26767,,12/12/11 8:46 AM (-05:00),,,12/12/11 11:24 AM (-08:00),
26769,2011-12-12 08:35AM EST,2011-12-12 08:46AM EST,D22,2011-12-12 11:32AM PST,2011-12-12 11:29AM PST,57
26791,12/12/11 7:00 PM (-06:00),,,12/12/11 10:15 PM (-05:00),,
26804,,7:12 PMDec 12,,,10:05 PMDec 12,
26809,December 12_ 2011               03:05 PM,December 12_ 2011               03:05 PM,45,December 12_ 2011               06:30 PM,December 12_ 2011               06:39 PM,58B
26811,,12/12/11 3:35 PM (-05:00),,,12/12/11 6:27 PM (-08:00),
26834,2011-12-12 15:05,,,2011-12-12 18:30,,
26861,,12/12/11 8:11 AM (-05:00),,,12/12/11 8:00 AM (-06:00),
26954,12:15 PM_ Dec 12,12:29 PM_ Dec 12,H3A,2:45 PM_ Dec 12,2:34 PM_ Dec 12,A3
26971,09:05 AM  Mon 12-Dec-2011,09:35 AM  Mon 12-Dec-2011,C14,12:35 PM  Mon 12-Dec-2011,01:00 PM  Mon 12-Dec-2011,D32
26988,,12/12/11 3:15 PM (-05:00),,,12/12/11 5:41 PM (-05:00),
26991,2011-12-12 02:55PM EST,2011-12-12 03:14PM EST,1,2011-12-12 05:46PM EST,2011-12-12 05:35PM EST,15
27010,Mon_ Dec 12 11:15 AM,Mon_ Dec 12 11:15 AM,D25,Mon_ Dec 12 1:40 PM,Mon_ Dec 12 2:03 PM,A6
27016,,2011-12-12 11:07,D25,,2011-12-12 14:03,A6
27020,,11:35 AMDec 12,,,1:59 PMDec 12,
27050,,12/12/11 8:00 PM (-06:00),,,12/12/11 10:31 PM (-07:00),
27072,2011-12-12 19:45,2011-12-12 19:46,,2011-12-12 22:30,2011-12-12 10:32 PM (Estimated),
27115,2011-12-12 07:45PM CST,2011-12-12 08:00PM CST,K9,2011-12-12 10:24PM MST,2011-12-12 10:24PM MST,6
27135,2011-12-12 9:45,,,2011-12-12 13:16,,
27137,Mon_ Dec 12 4:16 PM,Mon_ Dec 12 4:17 PM,B42,Mon_ Dec 12 7:35 PM,Mon_ Dec 12 7:15 PM,C26
27193,,12/12/11 1:39 PM (-05:00),,,12/12/11 4:00 PM (-05:00),
27245,,7:55 AMDec 12,,,9:17 AMDec 12,
27257,,2011-12-13 14:50,37,,2011-12-13 16:29,C13
27283,2011-12-13 8:42,2011-12-13 8:55,,2011-12-13 9:55,2011-12-13 10:27,
27412,2011-12-13 20:20,2011-12-13 20:12,,2011-12-13 21:20,2011-12-13 21:07,
27446,7:10aDec 13,7:03aDec 13,47A,3:30pDec 13,3:08pDec 13,B34
27461,07:00 AM  Tue 13-Dec-2011,06:53 AM  Tue 13-Dec-2011,1,09:55 AM  Tue 13-Dec-2011,09:22 AM  Tue 13-Dec-2011,D60
27462,07:00 AM  Tue 13-Dec-2011,06:53 AM  Tue 13-Dec-2011,1,09:55 AM  Tue 13-Dec-2011,09:22 AM  Tue 13-Dec-2011,D60
27468,7:00 AM_ Dec 13,7:11 AM_ Dec 13,,9:55 AM_ Dec 13,9:22 AM_ Dec 13,
27482,,12/13/11 6:06 AM (-06:00),,,12/13/11 7:00 AM (-06:00),
27527,6:30aDec 13,6:53aDec 13,D22,9:15aDec 13,9:38aDec 13,38
27542,2011-12-13 16:55,2011-12-13 16:55,,2011-12-13 20:05,2011-12-13 20:08,
27543,2011-12-13 16:55,2011-12-13 16:55,,2011-12-13 20:05,2011-12-13 20:08,
27553,Tue_ Dec 13 8:55 AM,Tue_ Dec 13 9:18 AM            Delayed,E3,Tue_ Dec 13 11:45 AM,Tue_ Dec 13 12:07 PM,15
27595,6:30pDec 13,,D45,7:25pDec 13,,14
27605,8:57 AM_ Dec 13,9:05 AM_ Dec 13,,11:35 AM_ Dec 13,11:32 AM_ Dec 13,
27630,11:05 AM_ Dec 13,11:31 AM_ Dec 13,,4:57 PM_ Dec 13,4:43 PM_ Dec 13,
27652,2011-12-13 11:55,2011-12-13 11:50,,2011-12-13 18:17,2011-12-13 18:12,
27700,11:40 AM_ Dec 13,,,1:17 PM_ Dec 13,12:55 PM_ Dec 13,
27720,12:00 PM  Tue 13-Dec-2011,12:14 PM  Tue 13-Dec-2011,B9,01:45 PM  Tue 13-Dec-2011,01:36 PM  Tue 13-Dec-2011,C15
27784,,12/13/2011 1:15PM CST,,,12/13/2011 2:28PM MST,
27800,Dec 13 - 1:00pm,Dec 13 - 1:02pm,A22/A,Dec 13 - 2:35pm,Dec 13 - 2:43pm,03-Apr
27822,6:00 AM_ Dec 13,6:14 AM_ Dec 13,,9:20 AM_ Dec 13,9:18 AM_ Dec 13,
27835,,12/13/11 4:10 PM (-05:00),,,12/13/11 5:54 PM (-05:00),
27861,,12/13/11 3:57 PM (-05:00),,,12/13/11 5:23 PM (-05:00),
27915,1:05 PM_ Dec 13,1:13 PM_ Dec 13,K12,2:35 PM_ Dec 13,2:36 PM_ Dec 13,A49
27932,12/13/11 2:30 PM (-06:00),,,12/13/11 7:03 PM (-05:00),,
27957,,12/13/11 5:38 PM (-06:00),,,12/13/11 6:18 PM (-06:00),
27994,,12/13/11 12:57 PM (-07:00),,,12/13/11 4:43 PM (-06:00),
28001,2011-12-13 12:54,,5,2011-12-13 17:13,,B11
28082,,2011-12-13 14:33,39,,2011-12-13 19:05,74
28133,2011-12-13 14:55,2011-12-13 14:48,,2011-12-13 16:49,2011-12-13 16:33,
28151,2011-12-13 09:00PM PST,2011-12-13 09:27PM PST,44I,2011-12-13 12:02AM MST,2011-12-13 12:04AM MST,A49
28153,09:00 PM  Tue 13-Dec-2011,,44,12:15 AM  Wed 14-Dec-2011,,A49
28159,9:00 PM_ Dec 13,,Terminal 4 - 44J,12:15 AM_ Dec 14,,A49
28172,9:00 PM_ Dec 13,Not Available,,12:15 AM_ Dec 14,Not Available,
28185,2011-12-13 7:55,2011-12-13 7:48,,2011-12-13 11:05,2011-12-13 10:54,
28198,7:55aDec 13,7:48aDec 13,B10B,11:05aDec 13,10:54aDec 13,3
28224,2011-12-13 14:35,,A7,,,
28239,2011-12-13 13:27,2011-12-13 13:24,,2011-12-13 16:25,2011-12-13 16:23,
28266,,7:40 AMDec 13,,,9:06 AMDec 13,
28267,,7:40 AMDec 13,,,9:06 AMDec 13,
28280,2011-12-13 11:57AM CST,2011-12-13 11:52AM CST,G14A,2011-12-13 01:45PM EST,2011-12-13 01:36PM EST,A3
28292,10:40 AM_ Dec 13,11:52 AM_ Dec 13,,12:55 PM_ Dec 13,1:42 PM_ Dec 13,
28312,2011-12-13 8:00,2011-12-13 7:57,,2011-12-13 11:55,2011-12-13 11:32,
28323,,,,2011-12-13 11:55,,85
28333,07:15 AM  Tue 13-Dec-2011,07:11 AM  Tue 13-Dec-2011,6,11:35 AM  Tue 13-Dec-2011,11:02 AM  Tue 13-Dec-2011,H15
28359,,2011-12-13 14:52,G16,,2011-12-13 16:41,3
28390,8:00 PM_ Dec 13,8:15 PM_ Dec 13,,9:50 PM_ Dec 13,9:52 PM_ Dec 13,
28391,8:00 PM_ Dec 13,8:15 PM_ Dec 13,Terminal A - 15,9:50 PM_ Dec 13,9:52 PM_ Dec 13,Terminal 3
28406,11:35 AM  Tue 13-Dec-2011,11:50 AM  Tue 13-Dec-2011,D32,02:25 PM  Tue 13-Dec-2011,02:16 PM  Tue 13-Dec-2011,46A
28453,12/13/11 7:10 PM (-06:00),,,12/13/11 8:56 PM (-08:00),,
28471,,12/13/11 8:40 AM (-05:00),,,12/13/11 9:00 AM (-05:00),
28495,,12/13/11 7:47 AM (-06:00),,,12/13/11 11:03 AM (-05:00),
28558,10:25 AM_ Dec 13,,Term 6 - 64,6:44 PM_ Dec 13,6:10 PM_ Dec 13,Term C - C128
28570,,12/13/2011 4:54PM CST,,,12/13/2011 8:09PM EST,
28591,2011-12-13 16:15,,,2011-12-13 19:55,,
28613,7:15 PM_ Dec 13,,Terminal 6,12:21 AM_ Dec 14,,Terminal C
28627,,2011-12-13 8:05,8,,2011-12-13 11:34,22
28686,6:00 AM_ Dec 13,6:12 AM_ Dec 13,,6:40 AM_ Dec 13,6:25 AM_ Dec 13,
28711,8:25 PM_ Dec 13,,,11:50 PM_ Dec 13,,
28740,8:40 AM_ Dec 13,,Main Term - C10,10:54 AM_ Dec 13,10:51 AM_ Dec 13,Term C - C19
28759,2011-12-13 6:59,2011-12-13 7:38,,2011-12-13 10:34,2011-12-13 10:30,
28797,Tue._ Dec.13_ 2011 6:00 a.m.,Tue._ Dec.13_ 2011 5:54 a.m.,,Tue._ Dec.13_ 2011 10:20 a.m.,Tue._ Dec.13_ 2011 10:11 a.m.,
28818,December 13_ 2011               07:15 AM,December 13_ 2011               07:10 AM,C26,December 13_ 2011               10:35 AM,December 13_ 2011               10:28 AM,15
28856,2011-12-13 10:40,2011-12-13 10:46,,2011-12-13 14:59,2011-12-13 14:53,
28910,,2:06 PMDec 13,,,7:23 PMDec 13,
28947,2011-12-13 02:30PM EST,2011-12-13 02:51PM EST,7,2011-12-13 05:50PM PST,2011-12-13 05:45PM PST,73
28955,2:30 PM_ Dec 13,2:53 PM_ Dec 13,7,6:15 PM_ Dec 13,5:50 PM_ Dec 13,Terminal 3 - 73
28978,2011-12-13 11:50,2011-12-13 11:49,,2011-12-13 15:50,2011-12-13 15:44,
28981,11:50 AM_ Dec 13,12:05 PM_ Dec 13,D40,3:50 PM_ Dec 13,3:40 PM_ Dec 13,A9
28982,11:50 AM_ Dec 13,12:05 PM_ Dec 13,D40,3:50 PM_ Dec 13,3:40 PM_ Dec 13,A9
29020,,12/13/2011 4:12PM CST,,,12/13/2011 6:03PM CST,
29045,12/13/2011 4:25PM PST,,,12/14/2011 12:29AM EST,,
29050,2011-12-13 04:25PM PST,2011-12-13 04:48PM PST,76,2011-12-13 12:20AM EST,2011-12-13 12:05AM EST,7
29099,,12/13/11 7:16 AM (-06:00),,,12/13/11 9:13 AM (-06:00),
29107,07:10 AM  Tue 13-Dec-2011,06:59 AM  Tue 13-Dec-2011,29,09:40 AM  Tue 13-Dec-2011,09:18 AM  Tue 13-Dec-2011,H3A
29118,7:10aDec 13,6:59aDec 13,A29,9:40aDec 13,9:18aDec 13,H3A
29254,5:25pDec 13,5:28pDec 13,135,8:22pDec 13,8:43pDec 13,39
29272,11:25aDec 13,11:58aDec 13,B22,2:50pDec 13,3:26pDec 13,40
29295,12:00 PM_ Dec 13,12:09 PM_ Dec 13,Terminal 8 - 46,3:15 PM_ Dec 13,3:17 PM_ Dec 13,Terminal 4 - 48B
29315,2011-12-13 8:35,2011-12-13 8:33,,2011-12-13 11:50,2011-12-13 11:27,
29326,,,,2011-12-13 11:50,,57
29396,2011-12-13 18:45,2011-12-13 18:42,,2011-12-13 21:10,2011-12-13 20:55,
29422,07:30 AM  Tue 13-Dec-2011,07:23 AM  Tue 13-Dec-2011,5,08:00 AM  Tue 13-Dec-2011,07:44 AM  Tue 13-Dec-2011,G1B
29447,11:25 PM  Tue 13-Dec-2011,,,06:55 AM  Wed 14-Dec-2011,,
29455,11:25 PM_ Dec 13,,Terminal 4 - 47A,6:55 AM_ Dec 14,,TBA
29487,12:10pDec 13,12:06pDec 13,1,2:15pDec 13,1:49pDec 13,31C
29675,12/13/11 9:45 AM (-05:00),,,12/13/11 1:16 PM (-06:00),,
29750,,10:58 AMDec 13,,,1:48 PMDec 13,
29802,,12/14/11 8:55 AM (-05:00),,,12/14/11 9:36 AM (-05:00),
29837,1:30 PM_ Dec 14,,,3:50 PM_ Dec 14,,
29840,1:30 PM_ Dec 14,Not Available,,3:50 PM_ Dec 14,Not Available,
29841,Dec 14 - 1:30pm,Dec 14 - Not Available,H10/T3,Dec 14 - 3:50pm,Dec 14 - Not Available,7
29845,2011-12-14 01:30PM CST,2011-12-14 01:40PM CST,H10,2011-12-14 03:30PM PST,2011-12-14 03:40PM PST,7
29885,,2011-12-14 12:27,C27,,2011-12-14 15:19,70A
29894,,12:40 PMDec 14,,,3:05 PMDec 14,
29899,,12:40 PMDec 14,,,3:05 PMDec 14,
29912,,12:40 PMDec 14,,,2:46 PMDec 14,
29954,,12/14/2011 7:20AM PST,,,12/14/2011 3:04PM EST,
29958,,12/14/11 7:20 AM (-08:00),,,12/14/11 3:04 PM (-05:00),
29989,2011-12-14 7:00,2011-12-14 7:00,,2011-12-14 9:55,2011-12-14 9:21,
30004,,12/14/11 6:15 AM (-06:00),,,12/14/11 7:04 AM (-06:00),
30030,,12/14/11 6:41 AM (-05:00),,,12/14/11 9:14 AM (-05:00),
30064,,2011-12-14 18:19,D30,,2011-12-14 20:05,6
30159,2011-12-14 11:05,2011-12-14 11:03,,2011-12-14 16:57,2011-12-14 16:50,
30178,11:55 AM  Wed 14-Dec-2011,11:51 AM  Wed 14-Dec-2011,B14,06:17 PM  Wed 14-Dec-2011,05:59 PM  Wed 14-Dec-2011,8
30182,2011-12-14 11:55,2011-12-14 11:51,,2011-12-14 18:17,2011-12-14 17:59,
30218,12/14/11 11:40 AM (-06:00),,,12/14/11 1:17 PM (-07:00),,
30220,2011-12-14 11:40AM CST,2011-12-14 11:52AM CST,E8,2011-12-14 12:45PM MST,2011-12-14 12:46PM MST,B18
30223,11:40 AM  Wed 14-Dec-2011,11:41 AM  Wed 14-Dec-2011,8,01:17 PM  Wed 14-Dec-2011,12:52 PM  Wed 14-Dec-2011,B18
30274,10:39 AM  Wed 14-Dec-2011,10:32 AM  Wed 14-Dec-2011,,11:19 AM  Wed 14-Dec-2011,11:35 AM  Wed 14-Dec-2011,
30295,,2011-12-14 0:32,60,,2011-12-14 5:18,32
30316,01:00 PM  Wed 14-Dec-2011,12:59 PM  Wed 14-Dec-2011,A29,02:35 PM  Wed 14-Dec-2011,02:43 PM  Wed 14-Dec-2011,4
30328,Dec 14 - 1:00pm,Dec 14 - 12:59pm,A29/A,Dec 14 - 2:35pm,Dec 14 - 2:43pm,03-Apr
30336,,12/14/11 6:03 AM (-06:00),,,12/14/11 9:02 AM (-05:00),
30339,,12/14/11 6:03 AM (-06:00),,,12/14/11 9:02 AM (-05:00),
30413,,2011-12-14 7:03,E35,,2011-12-14 10:19,D13
30416,2011-12-14 7:05,2011-12-14 7:03,,2011-12-14 10:31,2011-12-14 10:19,
30441,2011-12-14 13:05,2011-12-14 14:12,,2011-12-14 14:35,2011-12-14 15:56,
30500,5:30 PMDec 14,,,6:40 PMDec 14,,
30505,5:30 PMDec 14,,,6:40 PMDec 14,,
30531,2011-12-14 12:57,,3,2011-12-14 17:15,,C17
30533,,2011-12-14 12:57,3,,2011-12-14 17:20,C23
30548,12:57 PMDec 14,,,5:03 PMDec 14,,
30572,2011-12-14 12:57,,3,2011-12-14 17:15,,C23
30582,,12/14/11 11:11 AM (-06:00),,,12/14/11 2:40 PM (-05:00),
30588,2011-12-14 10:40,2011-12-14 10:57,,2011-12-14 14:45,2011-12-14 14:44,
30657,,2011-12-14 15:01,C16,,2011-12-14 16:40,85
30687,9:00 PM_ Dec 14,,Terminal 4 - 44J,12:15 AM_ Dec 15,,A49
30707,2011-12-14 7:55,2011-12-14 7:53,,2011-12-14 11:05,2011-12-14 10:57,
30712,7:55 AM_ Dec 14,8:09 AM_ Dec 14,,11:05 AM_ Dec 14,10:46 AM_ Dec 14,
30717,7:55aDec 14,7:53aDec 14,B23,11:05aDec 14,10:57aDec 14,3
30758,2011-12-14 13:33,2011-12-14 13:27,,2011-12-14 16:31,2011-12-14 16:15,
30768,2011-12-14 13:33,,B9,2011-12-14 16:31,,D11
30771,1:33 PM_ Dec 14,1:48 PM_ Dec 14,,4:31 PM_ Dec 14,4:11 PM_ Dec 14,
30774,,12/14/11 7:42 AM (-07:00),,,12/14/11 8:45 AM (-08:00),
30775,,12/14/11 7:42 AM (-07:00),,,12/14/11 8:45 AM (-08:00),
30795,,12/14/11 12:11 PM (-06:00),,,12/14/11 2:01 PM (-05:00),
30811,Dec 14 - 10:40am,Dec 14 - 11:52am,G2A/T3,Dec 14 - 12:55pm,Dec 14 - 2:04pm,A3
30873,12/14/11 2:53 PM (-05:00),,,12/14/11 4:45 PM (-06:00),,
30935,11:35 AM_ Dec 14,11:53 AM_ Dec 14,,2:25 PM_ Dec 14,2:22 PM_ Dec 14,
30945,Wed_ Dec 14 6:00 AM,Wed_ Dec 14 5:59 AM,70A,Wed_ Dec 14 7:23 AM,Wed_ Dec 14 7:20 AM,88
30952,,2011-12-14 5:59,70A,,2011-12-14 7:20,88
31030,7:25 AM_ Dec 14,7:41 AM_ Dec 14,D36,11:10 AM_ Dec 14,11:00 AM_ Dec 14,Terminal D - D22
31072,2011-12-14 10:25,2011-12-14 10:27,,2011-12-14 18:44,2011-12-14 18:34,
31074,,10:39 AMDec 14,,,6:34 PMDec 14,
31083,2011-12-14 10:25,2011-12-14 10:27,,2011-12-14 18:44,2011-12-14 18:34,
31100,4:15 PM_ Dec 14,4:31 PM_ Dec 14,D28,7:55 PM_ Dec 14,7:52 PM_ Dec 14,Terminal D - D51
31104,4:15 PM_ Dec 14,4:31 PM_ Dec 14,D28,7:55 PM_ Dec 14,7:52 PM_ Dec 14,Terminal D - D51
31159,December 14_ 2011               06:00 AM,December 14_ 2011               05:58 AM,2,December 14_ 2011               06:40 AM,December 14_ 2011               06:18 AM,44F
31194,08:25 PM  Wed 14-Dec-2011,,C14,11:50 PM  Wed 14-Dec-2011,,D32
31210,8:25pDec 14,,C14,11:50pDec 14,,D32
31215,12/14/11 8:40 AM (-05:00),,,12/14/11 10:54 AM (-06:00),,
31287,2011-12-14 8:35,,,2011-12-14 10:40,,
31291,12/14/11 6:00 AM (-06:00),,,12/14/11 10:20 AM (-05:00),,
31300,,6:15 AMDec 14,,,10:27 AMDec 14,
31317,2011-12-14 15:35,,5,2011-12-14 16:00,,G9
31370,2011-12-14 10:40,2011-12-14 10:42,,2011-12-14 14:59,2011-12-14 14:49,
31375,10:40 AM_ Dec 14,10:54 AM_ Dec 14,D21,2:59 PM_ Dec 14,2:49 PM_ Dec 14,Terminal 8 - 39
31381,2011-12-14 10:40,2011-12-14 10:42,,2011-12-14 14:59,2011-12-14 14:49,
31402,7:10 AM_ Dec 14,7:56 AM_ Dec 14,,9:35 AM_ Dec 14,9:59 AM_ Dec 14,
31421,,2:39 PMDec 14,,,8:26 PMDec 14,
31429,,2:39 PMDec 14,,,8:12 PMDec 14,
31447,,12:23 PMDec 14,,,2:42 PMDec 14,
31494,11:50 AM_ Dec 14,12:11 PM_ Dec 14,,3:50 PM_ Dec 14,3:49 PM_ Dec 14,
31500,2011-12-14 11:50,,,2011-12-14 15:50,,
31535,2011-12-14 04:00PM CST,2011-12-14 05:47PM CST,A29,2011-12-14 06:14PM CST,2011-12-14 07:45PM CST,H3A
31538,04:00 PM  Wed 14-Dec-2011,05:26 PM  Wed 14-Dec-2011,29,06:40 PM  Wed 14-Dec-2011,07:53 PM  Wed 14-Dec-2011,H3A
31549,5:25pDec 14,5:26pDec 14,A29,6:40pDec 14,7:53pDec 14,H3A
31578,2011-12-14 16:25,2011-12-14 4:28 PM (Estimated runway),,2011-12-14 0:29,2011-12-14 11:49 PM (Estimated runway),
31600,11:55 PM_ Dec 14,,,5:50 AM_ Dec 15,,
31672,09:15 AM  Wed 14-Dec-2011,09:14 AM  Wed 14-Dec-2011,71,12:18 PM  Wed 14-Dec-2011,11:59 AM  Wed 14-Dec-2011,39
31722,,3:13 PMDec 14,,,4:50 PMDec 14,
31741,2011-12-14 8:22,2011-12-14 8:17,,2011-12-14 10:13,2011-12-14 10:15,
31765,,8:08 AMDec 14,,,1:25 PMDec 14,
31798,,2011-12-14 11:32,B16,,2011-12-14 14:57,43
31840,,12/14/11 8:53 AM (-05:00),,,12/14/11 11:13 AM (-08:00),
31842,2011-12-14 08:35AM EST,2011-12-14 08:53AM EST,D1,2011-12-14 11:27AM PST,2011-12-14 11:19AM PST,57
31852,8:35 AM_ Dec 14,8:53 AM_ Dec 14,,11:50 AM_ Dec 14,11:24 AM_ Dec 14,
31931,6:45 PM_ Dec 14,7:18 PM_ Dec 14,Terminal 3,9:10 PM_ Dec 14,9:08 PM_ Dec 14,Terminal N
31968,December 14_ 2011               11:25 PM,December 14_ 2011,47B,December 15_ 2011               06:55 AM,December 15_ 2011,TBA
31997,,12/14/2011 12:21PM EST,,,12/14/2011 1:40PM EST,
32017,12:10pDec 14,12:01pDec 14,1,2:15pDec 14,2:02pDec 14,31B
32051,,12/14/11 9:13 AM (-06:00),,,12/14/11 12:06 PM (-05:00),
32061,9:05 AM_ Dec 14,9:13 AM_ Dec 14,C30,12:35 PM_ Dec 14,12:19 PM_ Dec 14,Terminal N
32065,9:05 AM_ Dec 14,9:13 AM_ Dec 14,C30,12:35 PM_ Dec 14,12:19 PM_ Dec 14,Terminal N
32119,December 14_ 2011               07:45 PM,December 14_ 2011,H15,December 14_ 2011               10:30 PM,December 14_ 2011,6
32140,,12/14/11 9:23 PM (-06:00),,,12/14/11 11:56 PM (-07:00),
32181,7:45 PM_ Dec 14,9:23 PM_ Dec 14,,10:30 PM_ Dec 14,,
32190,7:45 PM_ Dec 14,9:23 PM_ Dec 14,,10:30 PM_ Dec 14,,
32199,7:45pDec 14,9:04pDec 14,H15,1:08aDec 15,,6
32208,7:45 PM_ Dec 14,9:23 PM_ Dec 14,,10:30 PM_ Dec 14,11:59 PM_ Dec 14&nbsp(Estimated),
32221,2011-12-14 9:45,2011-12-14 9:41,,2011-12-14 13:16,2011-12-14 12:43,
32278,11:13pDec 14,,83,5:16aDec 15,,C19
32318,December 15_ 2011               08:25 PM,December 15_ 2011,A34,December 15_ 2011               11:50 PM,December 15_ 2011,D32
32357,Dec 15 - 1:30pm,Dec 15 - Not Available,H11B/T3,Dec 15 - 3:50pm,Dec 15 - Not Available,7
32373,06:00 AM  Thu 15-Dec-2011,05:59 AM  Thu 15-Dec-2011,E14,07:30 AM  Thu 15-Dec-2011,07:42 AM  Thu 15-Dec-2011,H5
32393,2011-12-15 07:15AM CST,2011-12-15 07:34AM CST,C20,2011-12-15 10:25AM EST,2011-12-15 10:37AM EST,17
32404,7:15 AM_ Dec 15,7:33 AM_ Dec 15,C20,10:35 AM_ Dec 15,10:38 AM_ Dec 15,17
32511,04:25 PM  Thu 15-Dec-2011,,,12:44 AM  Fri 16-Dec-2011,,
32526,2011-12-15 16:25,2011-12-15 4:29 PM (Estimated runway),,2011-12-15 0:44,2011-12-15 11:56 PM (Estimated runway),
32532,,12/15/11 6:15 AM (-06:00),,,12/15/11 9:13 AM (-05:00),
32559,,12/15/11 1:32 AM (-08:00),,,12/15/11 7:20 AM (-06:00),
32565,11:55 PM  Thu 15-Dec-2011,,,05:50 AM  Fri 16-Dec-2011,,
32593,2011-12-15 7:10,2011-12-15 7:09,,2011-12-15 9:40,2011-12-15 9:27,
32615,2011-12-15 06:45AM EST,2011-12-15 06:57AM EST,E5,2011-12-15 07:36AM EST,2011-12-15 07:37AM EST,15
32629,6:45aDec 15,6:41aDec 15,E5,7:45aDec 15,7:43aDec 15,15
32636,,12/15/11 1:04 PM (-07:00),,,12/15/11 5:02 PM (-06:00),
32637,,12/15/11 1:04 PM (-07:00),,,12/15/11 5:02 PM (-06:00),
32649,12:52pDec 15,,3,5:03pDec 15,,B7
32785,2011-12-15 23:13,,,2011-12-15 5:16,,
32799,12/15/11 7:41 PM (-08:00),,,12/16/11 12:44 AM (-06:00),,
32845,6:00aDec 15,6:49aDec 15,2,6:40aDec 15,7:11aDec 15,44E
32862,,8:05 AMDec 15,,,9:31 AMDec 15,
32865,7:35aDec 15,,E17,9:30aDec 16,,-
32878,,3:56 PMDec 16,,,5:43 PMDec 16,
32897,,2011-12-16 8:42,A2,,2011-12-16 9:58,
32903,,9:15 AMDec 16,,,9:58 AMDec 16,
32908,2011-12-16 8:42,,,2011-12-16 9:55,,
32917,12/16/11 1:30 PM (-06:00),,,12/16/11 3:50 PM (-08:00),,
32918,2011-12-16 01:30PM CST,2011-12-16 01:40PM CST,H14,2011-12-16 03:30PM PST,2011-12-16 03:40PM PST,7
32939,,12/16/2011 12:31PM EST,,,12/16/2011 2:22PM PST,
32946,,12/16/11 12:33 PM (-05:00),,,12/16/11 2:22 PM (-08:00),
32963,2011-12-16 12:20PM EST,2011-12-16 12:33PM EST,C27,2011-12-16 02:30PM PST,2011-12-16 02:22PM PST,70B
32970,,2011-12-16 12:19,C27,,2011-12-16 15:08,70B
32973,,2011-12-16 12:19,C27,,2011-12-16 14:33,70B
32991,,12:33 PMDec 16,,,2:46 PMDec 16,
33006,12:20pDec 16,12:19pDec 16,C27,3:08pDec 16,2:33pDec 16,70B
33020,,12/16/11 8:43 PM (-07:00),,,12/16/11 9:02 PM (-08:00),
33042,December 16_ 2011               07:10 AM,December 16_ 2011               07:08 AM,47A,December 16_ 2011               03:30 PM,December 16_ 2011               03:29 PM,B35
33063,7:10aDec 16,7:08aDec 16,47A,3:30pDec 16,3:29pDec 16,B35
33067,December 16_ 2011               07:00 AM,December 16_ 2011               07:01 AM,1,December 16_ 2011               09:55 AM,December 16_ 2011               09:41 AM,D55
33088,2011-12-16 7:00,,,2011-12-16 9:55,,
33134,6:30 AM_ Dec 16,6:40 AM_ Dec 16,,9:15 AM_ Dec 16,9:03 AM_ Dec 16,
33137,6:30 AM_ Dec 16,6:40 AM_ Dec 16,,9:15 AM_ Dec 16,8:59 AM_ Dec 16,
33162,2011-12-16 16:55,2011-12-16 17:09,,2011-12-16 20:05,2011-12-16 20:06,
33258,,12/16/11 12:07 PM (-07:00),,,12/16/11 5:47 PM (-05:00),
33271,11:55 AM_ Dec 16,12:07 PM_ Dec 16,Terminal 4,6:17 PM_ Dec 16,6:17 PM_ Dec 16,C29
33274,11:55aDec 16,11:53aDec 16,-,6:17pDec 16,5:47pDec 16,-
33284,,2011-12-16 11:16,27,,2011-12-16 17:16,H6
33295,2011-12-16 11:25,,,2011-12-16 17:25,,
33299,12/16/11 11:40 AM (-06:00),,,12/16/11 1:20 PM (-07:00),,
33322,,12/16/11 12:14 PM (-05:00),,,12/16/11 1:32 PM (-05:00),
33323,,12/16/11 12:14 PM (-05:00),,,12/16/11 1:32 PM (-05:00),
33345,,12/16/2011 11:21AM PST,,,12/16/2011 11:40AM PST,
33373,2011-12-16 12:30AM PST,2011-12-16 01:14AM PST,60,2011-12-16 05:26AM CST,2011-12-16 05:51AM CST,44
33449,,12/16/11 3:54 PM (-05:00),,,12/16/11 5:55 PM (-05:00),
33460,3:50 PM_ Dec 16,4:06 PM_ Dec 16,B13,6:23 PM_ Dec 16,6:15 PM_ Dec 16,58
33503,2011-12-16 7:00,2011-12-16 6:58,,2011-12-16 10:26,2011-12-16 10:13,
33585,,12/16/11 1:04 PM (-07:00),,,12/16/11 5:01 PM (-06:00),
33600,,2011-12-16 13:00,3,,2011-12-16 17:12,B5
33681,2:30pDec 16,2:35pDec 16,39,7:03pDec 16,7:02pDec 16,C80
33706,2011-12-16 7:10,2011-12-16 7:41,,2011-12-16 10:45,2011-12-16 10:33,
33807,2:35 PM_ Dec 16,2:46 PM_ Dec 16,,4:05 PM_ Dec 16,3:40 PM_ Dec 16,
33817,01:35 PM  Fri 16-Dec-2011,01:31 PM  Fri 16-Dec-2011,C24,04:38 PM  Fri 16-Dec-2011,04:18 PM  Fri 16-Dec-2011,D9
33839,,12/16/11 7:58 AM (-07:00),,,12/16/11 9:05 AM (-08:00),
33908,2011-12-16 8:25,2011-12-16 8:51,,2011-12-16 12:14,2011-12-16 11:39,
33922,2011-12-16 7:15,2011-12-16 7:16,,2011-12-16 11:35,2011-12-16 11:28,
33962,2011-12-16 08:00PM EST,2011-12-16 08:13PM EST,15,2011-12-16 09:40PM CST,2011-12-16 09:35PM CST,K4
33978,2011-12-16 20:00,,,2011-12-16 21:50,,
34045,,2011-12-16 19:16,41,,2011-12-16 21:03,61
34069,,8:43 AMDec 16,,,9:19 AMDec 16,
34091,2011-12-16 7:25,2011-12-16 7:23,,2011-12-16 11:10,2011-12-16 11:08,
34107,December 16_ 2011               10:15 AM,December 16_ 2011               10:17 AM,D17,December 16_ 2011               12:10 PM,December 16_ 2011               12:11 PM,T11
34138,,2011-12-16 11:01,60,,2011-12-16 19:10,92
34168,4:15 PM_ Dec 16,5:16 PM_ Dec 16,,7:55 PM_ Dec 16,9:05 PM_ Dec 16,
34178,2011-12-16 16:15,,,2011-12-16 19:55,,
34187,2011-12-16 07:41PM PST,2011-12-16 08:01PM PST,64,2011-12-16 12:42AM CST,2011-12-16 12:36AM CST,34
34192,2011-12-16 19:41,2011-12-16 7:41 PM (Estimated),,2011-12-16 0:44,2011-12-16 12:44 AM (Estimated),
34202,7:41pDec 16,,64,12:44aDec 17,,E15
34242,04:00 PM  Fri 16-Dec-2011,03:49 PM  Fri 16-Dec-2011,E3,06:46 PM  Fri 16-Dec-2011,06:25 PM  Fri 16-Dec-2011,C17
34276,6:00 AM_ Dec 16,6:17 AM_ Dec 16,,6:40 AM_ Dec 16,6:17 AM_ Dec 16,
34280,Dec 16 - 6:00am,Dec 16 - 6:00am,2,Dec 16 - 6:40am,Dec 16 - 6:17am,44I/T4
34284,6:00 AM_ Dec 16,6:17 AM_ Dec 16,,6:40 AM_ Dec 16,6:10 AM_ Dec 16,
34288,12/16/2011 8:25PM CST,,,12/16/2011 11:50PM EST,,
34387,,2011-12-16 6:05,42,,2011-12-16 10:39,135
34400,,12/16/11 3:43 PM (-05:00),,,12/16/11 3:36 PM (-06:00),
34426,,12/16/11 7:26 AM (-06:00),,,12/16/11 10:33 AM (-05:00),
34431,2011-12-16 07:15AM CST,2011-12-16 07:26AM CST,C33,2011-12-16 10:25AM EST,2011-12-16 10:28AM EST,15
34452,,12/16/11 11:01 AM (-06:00),,,12/16/11 2:26 PM (-05:00),
